no,name,rarity,attribute,story,cutin1,cutin2,cutin3
57,テオドール,2,無,「空白の時代」において、人間の解放を信念にかかげ、共和国を相手に戦う事を誓った青年。志を同じとしたクレメンス、ルドルフと共に、「白い狩人」を称し抵抗活動を行なっている。しかしなかなか目的を達成できず、焦りを感じる日々を送っている。,理想のためだッ！,おまえらなんかに！,理想を現実にッ！
58,ヨハン・マルス,3,火,御年82歳になる、老齢の剣士。当然ながら既に騎士団から引退して久しい。が、かつての相棒ドミニクが最前線に復帰したと聞き及び、老体に鞭打って自身も立ち上がった。温和な性格は変わっておらず、ドミニクが叱り、ヨハンがなだめる、という構図も相変わらずである。,ワシだけで十分だ！,攻撃こそ最大の防御じゃ！,みなぎってきたぞい！
59,クラウス・シュトローム,3,水,ドラゴンとの戦況はより悪化の一途を辿り、もはや最前線では無い、遠い故郷すら戦火に巻き込まれる可能性が出てきた。クラウスは妻と子を守るため、故郷からより遠く、しかし戦火のただ中である東の島国への遠征を進言。隊を率いての旅立ちを決意した。,耐えてみせろ！,私は守る！必ずだ！,絶対に通しはしない！
60,ミハエル・ヴァイス,3,光,その才能を十二分に生かし、騎士団長へと昇進したミハエル。その才覚で王国騎士団を率いるだけで無く、内外の政治にも口を出せるほどの立場となった。そんな彼の強引な手腕は、たびたび現在の王アルトリウスと対立しており、今、国は二つの派閥が対立する構造となっている。,我に敗北はない！,我が剣は主がために！,忠誠の恵みを受けよ
61,エルヴィン・シュバルツ,3,闇,ある朝のこと。エルヴィンが目を覚ますと家に人の気配が無く、隣の寝室で眠っていたはずの弟は姿を消していた。それから何年もの時が経ち、彼はひとつの噂を耳にする。それは、ある少女と共に旅をするドラゴン化した少年の話であり、その名は弟と同じ「シグムント」であった。,いつか必ず！,無駄なんかでは無いッ！,まだ終わってはいない！
62,テオドール・ゼーレ,3,無,「白い狩人」と名乗る反政府組織を束ねる指導者。その目的は崇高なものであると信じて疑わず、いつか必ず共和国を滅ぼす事を心に誓っている。そしてその目的のためには犠牲もやむを得ないと考えており、自身に反抗するクレメンスの処分を決定した。,ハハハハッ！,計画通りィ！,馬鹿めッ！
63,ドミニク,2,火,騎士団にて新米団員から恐れられている、鬼の教官騎士。甘ったれる者には容赦なく、場合によっては除隊すらさせる、常軌を逸した厳しさで接する。ただ、それは己の信じる正義に基づいた行動の結果であり、かつての恩師から受け継いだ意志を胸に、今日も激しく怒号をあげる。,甘ったれるな新米！,命を惜しめ！！
64,フリーデル,2,水,王国騎士になったばかりのフリーデルを襲ったのは窮地と絶望であった。ドラゴンによる所属隊の全滅。いままさにドラゴンが自分にもトドメを刺そうとする瞬間、一人の騎士が割って入り彼を救った。その騎士こそ、後に彼の隊長となるクラウスであった。,俺の力でッ！,やってやるッ！,状況を打開する！
65,アルフォンス,2,光,王族としての地位を剥奪され、一般兵として軍に所属するハメになった、元・王子。軍においては不遇の扱いを受けており、毎夜、涙で枕を濡らしている。しかし上司ミハエルから、百体のドラゴンを倒せば王族へ復帰させてやる、と言われており、その日を夢見て今日も頑張る。,ボクが！ボクが！,ボクに任せてよ！,ボクの出番だね！
66,エドガー,2,闇,普段は言葉を一切口にしない、無言の兵士。目的のためには手段を選ばず、仲間を犠牲にすることすらいとわない。ドラゴン討伐の任についている時のみ、激しく感情を昂ぶらせまるで激昂しているかのような掛け声と共に、対象へと槍を突き立てる。,シュコー……,あぁあああ！！,シュッシュー……
67,クレメンス,2,無,他の仲間と共に「白の狩人」と称し、ドラゴンを狩り続ける青年。「空白の時代」ではドラゴン狩りはご法度だが、彼らはその定められた法を破って活動を行なっている。その甲斐あってか槍の扱いは他の者よりも長けており、ことドラゴン狩りに至っては非常に優れた戦力となる。,こんなもんだろ,給料分の仕事だ,も一つおまけだ
68,ドミニク・マルス,3,火,かつての相棒ヨハンと共に、その豪腕を振るう騎士団特別顧問。その年齢は既に84と、なかなかのご老体だが、鎧の下にはいまだ衰えぬ若々しい肉体を保っている。恩師の言葉「絶対帰還」の元に、無駄な犠牲を増やさぬよう、新米騎士たちに厳しく接する姿勢は変わっていない。,甘ったれるな若造！,命を粗末にするな！！,任せておけ！
69,フリーデル・シュトローム,3,水,クラウスが率いる隊で、特攻隊長を務める戦士。手にした王国式機械槍で、クラウスや他の仲間と共に数々の武勲を上げてきた。次に赴く戦地こそ、今まで培った力の全てをぶつける死地であると感じているが、同時にクラウスの心中を察し、心を痛めている。,無駄な抵抗はやめろ！,観念したまえ！,おとなしくしろ！
70,アルフォンス・ヴァイス,3,光,百体のドラゴンを討伐するという偉業を達成しながら、なかなか出世出来ない不運な元・王子。軍においてはどうにか副隊長までこぎつけたが、部下から明らかにナメられており、毎夜、涙で枕を濡らしている。唯一の趣味である釣りを心の拠り所とし、週末を待ちつつ今日も頑張る。,頑張ってるのに！,ボクを認めてくれぇえ！,ボクの活躍を見てよ！
71,エドガー・シュバルツ,3,闇,数々のドラゴンを屠ってきた歴戦の兵士。自身の上に立つ者、下につく者、全てをかえりみず、いとも簡単に犠牲にしてきた。しかし感情を無くしたエドガーには、必然的かつ当然であり、役に立たぬ者が倒れていったという認識しか無く、当然弔う気持ちすら持ち合わせていない。,シュー…シュコー,お前らああぁあぁ！,シュッシュー……
72,クレメンス・ゼーレ,3,無,「処分」の期日を目前に控えた元反乱分子組織の戦士。ドラゴンとの争いが終わったはずなのに、どうして人間同士が争わなければならないのか、という持論を展開したが、それが元でテオドールの怒りを買い、今回の一件へと帰結した。,ま、これで十分だろ,人生、こんなもんかね,後悔先に立たずってね
73,ラファエル,2,火,ドラゴンと共に空を飛び、人里離れた谷に住む狩人の少女。他の地の人間やドラゴンと遭遇しないよう、細心の注意をはらって生活している。幼い頃に、住んでいた村が土砂崩れにあい、生き埋めになっていたところを、今の相棒であるドラゴンに助けられ、以来行動を共にしている。,たちはだかるか……,眠れッ！！,急所は外してやる
74,セリム,2,水,ドラゴンと人間が共存する谷に生まれた狩人の娘。相棒であるドラゴンと共に空を舞い、動物やモンスターを狩り、生計を立てている。谷は基本的に自給自足の生活を送っており、共存の事実が外界に知られることは無いが、近頃は戦火が谷の近くまで及び、僅かな不安を感じている。,終わりにしましょう,弱い魂では私は倒せない,弱さが急所となる
75,マクシミリアン,2,光,ドラゴンと人との共存を、王国に訴え続ける狩人の少女。彼女の生まれ育った谷では、ドラゴンと人間が持ちつ持たれつの関係で生活する事が当たり前であり、敵対し合うなどあり得ない事である。その為、無益な戦争をやめさせようと、ドラゴンとともに王都へと舞い降りた。,本当はこんなこと……,やむを…得ないッ！,争いは何も生まない……
76,イザーク,2,闇,帝国軍のドラゴン部隊隊長を務める若き女兵士。彼女は、ドラゴンと人間が共存する世にも珍しい谷郷の出身であり、帝国軍に加入するまではドラゴンと共に賞金稼ぎめいたことを行なっていた。軍においては最前線に投入できるドラゴンを探すため、捕獲隊として部隊を率いている。,腰抜けが！,受け取れっ！,苦しまずに逝け！
77,ルドルフ,2,無,「白の狩人」と呼ばれる組織で、ご法度であるドラゴン狩りに精を出す少女。ドラゴンを狩ることに喜びを感じており、テオドールの掲げる人間解放などは、建前以外のなにものとも思ってはいない。いかにドラゴンを仕留めるか、それだけを考え、日々を過ごしている。,貴様の存在を否定する,道化の極みだな
78,ラファエル・マルス,3,火,悠久の谷と呼ばれる場所で、長を務める狩人の女性。ドラゴンと人間が共存するこの谷には、各地から身寄りの無い子供や、害意の無いドラゴンが集められ共に暮らしている。彼女が人間とドラゴン、それぞれに役割を与え管理することで、谷は安定した生活を送ることができている。,これも運命……,いっそひと思いに！！,苦しめてすまない
79,セリム・シュトローム,3,水,ドラゴンと共に、世界中のドラゴンの生態を調査し続ける女狩人。人間とドラゴンとの争いの原因を探るため、世界各地へと飛び回っている。彼女にとって双方の間で行われる争いは耐え難いものであるが、一方で、完全に争いを止めるためには犠牲がやむを得ないことも悟っている。,仕方がないか……,犠牲はやむをえまい,これも未来の為だ
80,マクシミリアン・ヴァイス,3,光,ドラゴンと共に、ドラゴンを狩り続ける女戦士。元々は人間とドラゴンの共存を王国に訴えていたが、谷の存在をつきとめた騎士団団長が、その存亡を盾にとり彼女に脅しをかけた。彼女は自らの失策を悔やみつつも、谷に残るドラゴンや孤児たちを守るため、ドラゴンを狩り続ける。,処断、開始！,対象を滅する！,救護、開始！
81,イザーク・シュバルツ,3,闇,ドラゴンたちを捕獲し続ける、帝国軍所属の女隊長。時折、ドラゴンと行動を共にする事もあるが、しかしドラゴンのことはただの道具としてしかみなしておらず、特別な感情をもったことも無い。今は、故郷の谷に存在する豊富なドラゴンを、いかに捕獲するかの計画を練っている。,腑抜けが！,遠慮するな、くらえ！,ぶち抜いてやるよ
82,ルドルフ・ゼーレ,3,無,ドラゴンだけに飽きたらず、人間すらも狩りの対象とし始めた女戦士。「白の狩人」と自称する組織が、過激な団体として民衆に認知されているのも、彼女の活動によるところが大きい。その首には莫大な懸賞金も懸かっており、彼女を狙う者もまた数多く存在している。,貴様の生命を消し去る,嘲りに過ぎんな,撃ち尽くすべく
83,リーゼロッテ,2,火,炎の魔導師としての修行を積む少女。彼女の師匠、賢者レイチェルの教えの元、日々鍛錬を積んでいる。レイチェルが時折見せてくれる「爆炎花」は、夜の空を彩る華麗な炎の舞いであり、リーゼロッテも、いつか同じように美しい炎を生み出したいと考えている。,お眠りなさい…,御託はいらないでしょう？,炎に包まれなさい
84,フローラ,2,水,祈祷師として幼少の頃より周囲の期待を一心に受けて育った少女。魔法の修行にも熱心に打ち込み、自分の実力を上達させてきたが、いつしか彼女の居る土地には雨が絶えなくなってしまった。ただ、これが良い目眩ましとなり、雨を嫌うドラゴンを遠ざける役目も果たしている。,覚悟してください！,容赦しません！,雨が……
85,パトリシア,2,光,何千年も続く「教国」と呼ばれる土地の使者によって囚われた、若き魔導師。小さな村の生まれながら幼い頃よりその魔術の才の片鱗を見せ、周囲の者たちの期待を背負ってきた。ただ、時折その強大な力を暴走させてしまうことがあり、自分自身に怯える日々を送っていた。,ご、ごめんなさいッ！,あわわ、すみません！,たたた、たいへんです！
86,ワルプルギス,2,闇,代々魔導師を引き継ぐ家系に生まれた、元気活発な少女。その実力は、すでに歴代の魔導師の中でも一位二位を争っており、次期当主としての呼び声も高い。しかし本人には一切その気は無く、近くに住む年下の少年エドガーとの、山や川での遊びに楽しさを見出している。,跪きなさい,これで終焉よ,闇が喰らう
87,オクタヴィア,2,無,賢者ローザによって生み出されたホムンクルス。仕組みはよりしろと同様だが、よりしろと明確に異なる点として自我を持っている。あくまでローザのお遊びによって生み出されただけの存在だが、オクタヴィア自身は、その意味、そして本質を自問し続けている。,いきます……,さようなら……
88,リーゼロッテ・マルス,3,火,騎士団に所属する優秀な魔導師。数々のドラゴンを討伐することで、その名をあげてきた。唯一の趣味である「爆炎花」は、非常に高等な魔法であるが、それを習得した彼女は天性の素質があったといえる。そんな彼女は今日も「爆炎花」を楽しむため、ドラゴンの捕獲に精を出す。,消えてしまいなさい…,芸術は爆炎よ,爆炎の花が咲く
89,フローラ・シュトローム,3,水,雨を降らせ続ける祈祷師として、各地を転々とする女性。もはや祈祷などせずとも彼女の周りには雨が振り続ける有様だが、干ばつに苦しむ土地の民にとっては女神も同然である。フローラ本人もそれを良しとはしているが、いつか澄み切った青空をもう一度見たいと夢見ている。,お別れです！,全力でいきます！,力を出し切ります！
90,パトリシア・ヴァイス,3,光,「教国」の教えの元で正しく成長した麗しき魔導師。今では自分の魔力を完全にコントロール出来るようになり、昔のように怯えて暮らす日々は終わった。しかし同時に、世界の因果律を崩壊させる「祖龍」の存在に勘付き、刻々と迫る世界の破滅を食い止めるため活動している。,正義の裁きよ！,歪みを正します！,光の力を！
91,ワルプルギス・シュバルツ,3,闇,歴代の一族の中で、最も強い力を得て当主となった魔導師。その実力は、すでに各国へと知れ渡り、方方からドラゴン討伐や新魔法の開発を依頼されている。そんな折、幼馴染のエドガーが帝国軍へ入隊するとの連絡を受け、多忙の疲れを押して遠方の地よりの帰路についた。,子供は寝る時間よ,安心なさい、すぐ終わるわ,闇が喰らい尽くす
92,オクタヴィア・ゼーレ,3,無,人間になりたい人形。<br class="spacer">ただそれだけの存在であると、<br class="spacer">オクタヴィアは悟った。,あ……,……,え……
93,さくら,3,火,サムライと呼ばれる、竜の退治を生業とする父を持つ少女。幼い頃から父の指導の元、厳しく育て上げられ、すでに自身の通う道場においては師範代を任されている。幼馴染のにじょうとは犬猿の仲であり、事あるごとに対立しているが、さくらも、彼の実力だけは認めている。,本気で行くよ！,精進が足りないよ！,気合い入れてくよ！
94,かすみ,3,水,幼い頃、異国の騎士に命を救われた少女。その他人を守る為に全力を尽くす姿勢に感激し、自身も剣士となる事を決めた。争いを好まない両親を説得することには骨をおったが、竜退治の職が認知されてきたこともあり、どうにかサムライとなることの許しを得た。,死に花を咲かせてあげる,黄泉の国がお似合いよ,牙は届かない
95,つばき,3,光,伝説の料理人の血を引く、極限の天才料理人……といいたいところではあるが、まだまだ修行中の見習い料理人。祖先を同じとする全能の天才見習い料理人、ひめじとはお互い争い合う仲であり定期的に行われる極限対全能の料理対決はワノクニ中の注目を集めている。,こっけいだねぇ！！,とうふは大きく切る！,うん、美味い！
96,あやめ,3,闇,ゼロシキと共に、竜退治の旅を続ける少女。幼い頃、竜に襲われたところをゼロシキに救われ、以来共に旅を続けている。暗殺者の資質を持ちあわせており、その点ではゼロシキの手を煩わせることは無いが、兎に角料理が下手であり、何度となくゼロシキの命を危険にさらしている。,さよう…なら……,もう、おしまい,にがさ…ない…
97,ぼたん,3,無,竜退治を生業とする里に生まれた名も無き少女。ぼたんという名は、その代の娘が必ず受け継ぐ名であり、個人をさすものというより、いわば記号のような扱いの名前である。心を殺し、自我を持たず、ただ命じられるままに竜を退治するその姿は、まるで人形のようとも形容される。,お覚悟……ください,消えて……ください,耐えて……ください
98,焔神一刀流さくら,4,火,立派だった父のように、自身も人を守るためサムライとなった女剣士。竜の首を一刀の元に切り落としたことから「首切り」という恐ろしげな異名で知られるが、それは実際には相方であるにじょうがやった事であり、自身がそんな呼ばれ方をされている事に納得がいっていない。,とりあえず勝たなきゃ,言ったよ、本気だって！,本気でいくよ！
99,水天一心流かすみ,4,水,竜を退治し人々を守る若きサムライ。その旅の道中で、かつて彼女を救った異国の騎士の娘である「あーにゃ」という少女に出会う。あーにゃが抱いていた父親像は多少歪んでいたものの、その騎士道精神は受け継がれていることを知り、遠い異国の地に思いを馳せ彼女は安堵した。,死に化粧はいかが？,三途の底がお似合いよ,守ることこそ天命
100,天照一閃流つばき,4,光,伝説の料理人「イザナギ」の正統後継者である、極限の天才料理人。ひめじとの極限対全能の料理対決において勝利をおさめ、その名誉と共に正統後継者の座を引き継いだ。今では「光の料理人」として人の世を料理で救うため、日々素材集めにいそしんでいる。,もったいないなぁ,大きすぎるよ、これは！,美味なもんだなぁ
