no,name,rarity,attribute,story,cutin1,cutin2,cutin3
1,アレン,3,火,代々、王国の騎士を務める家系に生まれ、自らもまた騎士を目指し修練に励む少年。ドラゴンを討伐することより、いかに街や人々を守り抜くかということを考えて行動している。より多くの人を守れるようになるため、国衛騎士団への入団試験でもある武闘大会への出場を決意した。,ボクだってやれるんだ！,これが全身全力だ！,必ず守ってみせる！
2,戦士アレン,4,火,武闘大会で優勝した事で、その実力が認められ、晴れて国衛騎士団への入団が叶った青年。共に騎士団へと入団した仲間たちとは、そのまっすぐすぎる正義感ゆえに意見がぶつかることも多い。しかし、絶対に曲げないその騎士道精神は、次第に多くの者の共感を集めつつある。,皆を守る！それだけだ！,これで終わりさ！,絶対に帰還させる！
3,王国騎士アレン,5,火,国衛騎士団団長としてたくましく成長したアレン。自ら過酷な状況に飛び込んでいく勇ましさは衰えず、むしろ実力が伴った分、前にも増して拍車が掛かっている。ただ、そこに仲間を巻き込むことは決してせず、先祖からの教え「絶対帰還」を仲間にも厳守させている。,王国騎士団の剣を受けろ！,これが未来を信じる力だ！,誰も死なせはしない！
4,カイン,3,闇,幼い頃に両親を亡くし、一人孤独に生きてきた少年。力こそが全てであり、その妨げになるものには一切興味を示さない。この世のどこかにあるという「邪竜の魔眼」を手に入れる手がかりを探すため、王都へとやってきた。,愚衆風情が！,俺の前から消え去れ愚衆！,これが俺の力だッ！！
5,勇士カイン,4,闇,探し続けている「邪竜の魔眼」の情報を求め参加した武闘大会での活躍が認められ、国衛騎士団へと入団した青年。しかし、いまやその興味の矛先は、武闘大会で自分を打ち負かしたアレンに向いている。今はドラゴン討伐を通じて、日々アレンと競い合っている。,鈍間め！見えてるぞ！,八つ裂きにしてやる！,受け取れ！闇の洗礼を！
6,近衛騎士カイン,5,闇,「邪竜の魔眼」を手に入れ闇の力に目覚めた魔騎士。魔眼は全ての死線を見極め、対象に確実な死をもたらす。その力はドラゴンを倒すごとに強まっており、更なる力を求めカインはドラゴンを狩り続ける。全てのドラゴンを狩り終えた時その槍の矛先が向けられるのは果たして……。,俺には全てが見えている！,邪眼の覚醒を見ろ！愚衆！,邪眼は全てを駆逐する！
7,ルカ,3,水,太古から続く竜人の血を引く部族の娘。その血筋は限りなく薄まってはいるが、それでも常人よりは遥かに寿命が長く、既に齢は100を超えている。長きに渡る人とドラゴンの戦いを終わらせるため竜人の祖先とされる人物を探していたが、その者が現れたと聞き及び王都を訪れた。,私に見えぬ風は無い！,射抜け我が羽矢！,受けてみよ！竜人の力！
8,範士ルカ,4,水,難関の試験を突破し、国衛騎士団へと入団した竜人族の娘。ほんの些細な興味心で訪れた武闘大会で見た火の剣士と闇の戦士との戦いは、彼女の部族に伝わる伝説の序章と瓜二つの展開であった。その伝説の結末を見届けるため、彼女は国衛騎士団への入団を決意した。,竜人の矢を受けてみろ！,何の足しにもならん！,これで貴様は袋の鼠だ
9,遊撃手ルカ,5,水,一族総勢100人を率い、ドラゴンに立ち向かう竜人族の族長。火の剣士と闇の戦士の大決闘の後、一時的に騎士団を離れていたが、世界に散った竜人族の生き残りを集め、再び王都に舞い戻った。いずれ訪れる最終決戦に向け、「禁書館」にて着々と準備を進めている。,竜人の怒りを感じろ！,竜の血で全てを浄化する！,貴様の勝機を奪う
10,マリア,3,光,この歳にして魔法術を極めている、この国の王の娘。まだ幼い頃に、ドラゴンから王都を守り犠牲になった王妃の事を強く尊敬している。一方父である国王の過保護っぷりには少々疲れを感じており、近頃ではこっそり街へ出て武闘大会の見学などをして楽しんでいる。,ここは私に任せて！,光の加護よ祝福よ！,回復なら任せてください！
11,司祭マリア,4,光,聖なる力で王都を守り、司祭として騎士団を指揮する若き指導者。武闘大会の最中に王都を襲ったドラゴンを火の剣士、闇の戦士、水の射手と共に撃退し、傷ついた者たちを一瞬にして癒すという奇跡を発現させた。「守る者」へと変わったその時、彼女はこの戦争の終わりを誓った。,やむを得ません！！,目覚めよ大地の精霊たち！,聖なる光で癒やします！
12,聖女マリア,5,光,謎の病に倒れた国王に代わり、民衆を率いドラゴンに立ち向かう聖女。幾度と無く奇跡を起こし王都を救ってきた彼女だが、それは仲間のおかげであると信じている。実は自身も国王と同じ病に侵されているが、その事実をひた隠し、皆の前では気丈に振る舞う。,光の祝福を我らに！,聖なる光で悪を討ちます！,精霊よ、我らに光を！
13,ラビ,1,火,幼馴染のアーロン、アナスタシア、カロルと共にドラゴン討伐を目指す、ごく普通の村の少年。小さなころから大人を相手に剣の修業を積んでいたので、剣の腕には多少の覚えがある。ドラゴンを討伐し、この世に平和をもたらす英雄になる日を夢見ている。,練習どおりに！,俺だってやれるさ！,本気でいくぞ！
14,カルル,1,水,漁師を生業とする家系に生まれた少年。ドラゴンやモンスターが海を荒らすことが許せず、元凶を退治するため討伐の旅に出る。幼い頃に亡くした父が語ってくれた、ある海姫の物語を心の拠り所とし、一人孤独に海を渡っている。,よし、チャンスだ！,勝機は逃さないさ！,ここが我慢のしどころさ
15,アレクセイ,1,光,同じ村の出身であるミハエルと共に、王国騎士の資格試験を受けるため、王都へとやって来た少年。結果、試験には惨敗し、ミハエルとの格の違いを見せつけられる結果となったが、それを転機に、真面目に修行に打ち込むようになった。,いくぞ！,我が剣にかけて！,傷の手当をしよう
16,ヴィクトール,1,闇,アーヴィングに付き従う、若き自警団員の少年。アーヴィングの強さ、カリスマ性に心酔しており、彼と行動を共にする事を生きがいとしている。ゆえに、彼が執心するリュドミラを快く思っておらず、いずれは村から排除しようと画策をしている。,消えちまいな！,さっさと消えろ！
17,ユーリー,1,無,動物の生態を調べることを趣味とし、村の裏の山林へと入り浸っている少年。もともとドラゴンにはあまり関心が無かったが、イノシシの姿にそっくりなドラゴンが存在すると知ってからは、その生態を探ることに没頭する毎日を送っている。,これも仕事だからな！,さっさと終わらせるぞ！,こっちの番だ！！
18,ラビ・プラーナ,2,火,この世に平和をもたらすことを目指し、ドラゴンを討伐する旅を続けている青年。数年に及ぶ戦いのなかで、剣の腕は一層磨かれた。また、自分の責で、かけがえの無い存在であったアナスタシアを失ってからは、仲間を思いやる冷静さも身に付け、仲間からの信頼は厚くなっている。,俺だってもう一人前だ！,俺の力はみんなのために！
19,カルル・ヴァルナー,2,水,漁師だった父を尊敬し、その父親が愛した海を守るためドラゴン討伐の旅を続ける青年。同時に、かつて父が語って聞かせてくれた海姫の伝説についても各地で言い伝えを聞き集めており、それを書にしたためている。いつか子供たちにその物語を語り聞かせるのが彼の今の夢である。,勝機に遠慮はしないさ,今回の賭けは俺の勝ちさ,勝てない賭けはしないのさ
20,アレクセイ・クレスト,2,光,王都で、王の護衛団員を務める若き騎士。騎士王アルトリウス直属の部下であり、騎士王からの信頼も厚く、その実力たるや、いまや王国騎士と比較してもなんら遜色は無い。また、アレクセイの個性として、守りに全力を尽くす、というスタンスが民衆からの支持を集めている。,突撃するぞ！,我が誇りにかけて！,傷を癒やさなければ
21,ヴィクトール・ストラーフ,2,闇,アーヴィングを慕い付き従ってきたヴィクトールだったが、彼の目が自分に向いてくれることは無かった。それどころか苦心して追い払ったリュドミラを捜索すると言い村から出ていった彼には既に怒りしか感じておらず、最早その剣はいつ狂気に走ってもおかしくない状態である。,消えろーっ！,そのまま消え去れ！,止まれと言っている！
22,ユーリー・ヴァロッツァ,2,無,幼い頃にイノシシのようなドラゴンに追い掛け回されて以来、すっかり動物が苦手になってしまった青年。しかし動物を嫌いになったわけでは無く、生態の調査は引き続き行なっている。その過程でドラゴンが謎の大量消失を遂げている事実を知り、更なる調査の必要性を感じている。,仕事はきっちり正確に！,残業はしない主義だ！,準備は万全に！
23,アーロン,1,火,幼馴染のラビをライバル視しており、誰よりも早くドラゴンを倒し手柄を立てたいと思っている野心家。戦いの才能も申し分ないが、皆に見えないところでこっそりと鍛錬を積んでいるという、努力家な一面もある。,どけってんだ！,これが俺の力だ！,喰らいやがれッ！
24,レオニード,1,水,日々変わることの無い海の景色に退屈し、街で遊びに興じている少年。大胆でユーモアにも富んでいるため遊び仲間からの信頼は厚く、その手の方面には多少名も知られている。さらなる名声を求めて、相棒のキリルと共に、ドラゴン退治の旅に出た。,掃除は得意なのさ,燃えないゴミってか？
25,ロラン,1,光,村一番の豪傑として、近隣の町や王都へもその名が知れた槍使いの少年。ある時その評判を聞いた騎士王が村へ訪れロランと手合わせを行った。そしてロランは王の強さ、そして器の大きさの一端に触れ、彼の元で共に戦う事を決意した。,国の平和は私が護る！,私の信念にかけて！,受けてみろッ！
26,アーヴィング,1,闇,幼い頃に、村の近くで発生したドラゴンとの戦いで、自警団員だった両親を失った少年。その遺志はしっかりと受け継がれており、アーヴィングは村始まって以来最年少の自警団長となった。今は次の目標として、リュドミラを自分に従わせる事に執心している。,ケモノ風情が！,さっさと逝っちまえ！,終わらせてやる
27,イェゴール,1,無,イノシシの姿をしたドラゴン、通称「バハムートン」を狩り続ける鋼の料理人。バハムートンの肉は、柔らかく、それでいて程よい歯ごたえがありジューシーで、焼けば肉汁したたる最高級の肉質を兼ね備えており、料理人にとっては最高の食材であるといえる。,ふん,終わりだ,準備は整った
28,アーロン・プラーナ,2,火,何かにつけてラビと競い合っていたが、旅の厳しさ、そしてかけがえの無い仲間を失った事で成長し、今ではお互いの背中を預け合う、良きパートナーとなった。今、その槍は自己顕示のためでなく、仲間を守るために揮われている。,どけよっ！,力だ！力こそ全てだ！
29,レオニード・ヴァルナー,2,水,ドラゴンを討伐し、町を守ることでそこそこ名を上げた青年。しかし以前からの遊び癖が抜けず、仲間たちに報酬をばらまいてしまうため、今はこつこつ傭兵の仕事をこなしている。かつての相棒だったキリルとは、雇い主と傭兵という立場になっても、ついえぬ友情が続いている。,汚れの掃除はお手の物！,消毒ならお任せってな,さぁ仕上げだ
30,ロラン・クレスト,2,光,騎士王アルトリウスの護衛団副長を務める青年。エンゼリカ、アレクセイと合わせ王国三銃士と呼ばれ、騎士王と共にドラゴンを討伐する日々を送っている。強大過ぎる力が民衆から畏怖の対象となる時もあるが、それにもめげず、国、そして民の為、彼は槍を振るう。,明日の平和のために！,私の力は国王のために！,私は王の槍となる！
31,アーヴィング・ストラーフ,2,闇,ある日突然姿を消した、友人のリュドミラとシグムントを探し出す為の旅を続ける青年。旅に出て、既に幾年もの月日が経っているが、二人の行方はようとして知れず、また、ある機関の処刑人が二人を追っていると聞きつけ、焦りはいっそう募るばかりである。,ケモノごときが！,さっさと消えちまえ！,終わりにしてやる
32,イェゴール・ヴァロッツァ,2,無,バハムートン料理研究家との通り名で呼ばれる鋼鉄の料理人。その手から繰り出される絶妙な槍包丁さばきは、既に人の域を超えており彼の目標とする人物の域にまで到達しつつある。それはすなわち料理人たちの神、イザナギの域……神の領域である。,よし,決まりだ,これでいこう
33,アナスタシア,1,火,ドラゴンへの関心が強く、討伐というよりも、自身の目で実際に見てみたい、という憧れを胸に秘めている少女。遺跡やダンジョンにも目が無く、いつの間にやら姿が見えなくなっていることも少なくない。そのたびラビや、他の仲間たちを困らせている。,い、いきます！,わ、私だって！,こ、これなら！
34,アーニャ,1,水,ドラゴン討伐の名目で家族を置き去りにし、遠征の途についた野心家で身勝手な父を探し出すため、旅に出ることにした少女。とてもしっかりした性格で、足の不自由な母親の代わりに家の事をすべて一人でこなしていたが、その母を亡くした事で今回の旅立ちを決意した。,この距離なら！,この一撃で仕留める！,食い止めてみせる！
35,エレオノーラ,1,光,小さな村の領主の娘。非常に恵まれた環境で育ったせいか、とんでもなく世間からずれた感覚を身につけており、心配した両親が王都にある全寮制の女学校への転入を決めた。厳しい事で有名な学校ではあるが、持ち前の明るさと弓においての天賦の才で、うまくやっている。,ビューティフル！,エクセレント！,ワンダフル！
36,リュドミラ,1,闇,村の若者たちのリーダーであり、ひときわ強いカリスマ性を放つじゃじゃ馬娘。男も女もまるで奴隷のようにひきつれて、ドラゴン退治に乗り出す。幼馴染のシグムントにだけは心を開いているようで、彼の忠告にはなぜか素直に従う。,汚らわしい！,消えなさい！,去りなさい！
37,エヴァ,1,無,鋼の料理人イェゴールの助手を務める若き料理人。その舌には天賦の才があると言っても良く、助手とは言いつつ、彼には高圧的な態度を取っている。実際のところレシピを考えるのはエヴァ、調理をするのがイェゴールといった役割分担で、うまくやっている。,無様ね…,無粋ね…,無謀ね…
38,アナスタシア・プラーナ,2,火,ドラゴンへの関心が強く、旅を続けることでその生態を調査している女性。さらなる研究のためにはドラゴンに負けない強さが必要と思い知り、鍛錬にも励むようになった。共に旅を続ける、仲間のラビが、後先を考えずに無鉄砲な行動を取ることが最近の悩みの種。,こ、これならどうです,私だって出来ます！
39,アーニャ・ヴァルナー,2,水,東の島国に渡ったアーニャは、そこで一人の女剣士からある話を聞いた。それは、故郷に残した家族を想い、そして誰よりも平和を願って戦ったアーニャの父の物語であった。もちろんそれを聞いたからといってすぐに父を許す事は出来ないが、それでも彼は彼女の誇りとなった。,有効射程内！捉えた！,この一撃は外さない！
40,エレオノーラ・クレスト,2,光,女学校での数年に渡る生活は、世間知らずのおてんば娘を一人の立派な女性へと成長させた。とはいっても持ち前の底抜けの明るさはそのままであり、周りとは多少ずれた発言をすることもしばしば。しかしそれゆえ、タッグを組んだエドワーズとは良いでこぼこコンビとなっている。,マーベラス！,ブリリアント！,アメージング！
41,リュドミラ・ストラーフ,2,闇,じゃじゃ馬っぷりはいまだ健在で、人々を巻き込む無茶な戦い方は、皆からある意味恐れられている。しかし彼女に付き従う者は、彼女が誰よりも強く平和を願っている事を知っており、だからこそ我が身を顧みず、彼女と共に戦う事を固く決意している。,痴れ者が！,散りなさい！,退きなさい！
42,エヴァ・ヴァロッツァ,2,無,イェゴールの元から独立し、自身の道を歩み始めた新進気鋭の料理人。イェゴールの言う料理人の神だかなんだかに嫌気がさし、彼の元をあとにした。料理において大切なのは感謝の心であると悟り、その精神が息づく遥か東の島国で修行を積む決意をした。,不細工ね…,醜いわ…,臭いわね…
43,カロル,1,火,幼馴染のラビに誘われて、いつの間にか戦いに参加していた少年。本当は村の林檎畑に寝転がり、昼寝をしたいと思っているのんびり屋。マイペースだが、魔法の腕は確かであり、またなによりも、皆のムードメーカとして無くてはならない存在である。,いっけ～！,そこだ～！
44,キリル,1,水,代々魔法を生業とする一族に生まれた少年。魔法使いとしての古いしきたりに飽き飽きしており、夜な夜な街へ繰り出しては遊びに興じている。名声などには一切興味が無いが、親友であるレオニードの誘いもあって、遊び感覚でドラゴン討伐の旅を始めた。,お生憎様,いつもの威勢はどうした？,残念だったね
45,ブルクハルト,1,光,ある小さな村で生まれた少年。幼馴染のパトリシアと共に平穏ながらも幸せな毎日を送っていた。しかしある日、村に現れた「教国」の使者達によって、パトリシアは連れさらわれてしまう。ブルクハルトは彼女を連れ戻すため魔法の修行を積み、旅に出る決意をした。,ボボ、ボクだって！,この一戦、負けられない！,や、やってやる！
46,シグムント,1,闇,数年前、村からほど近い山林で発生したドラゴンとの戦いの直後に村へとやってきた、記憶を無くした少年。名前以外は、自身の事を一切覚えておらず、また村の者ともほとんど口を利いたことが無い。しかし、唯一リュドミラとは、少ないながらも言葉を交わす間柄となっている。,きえて……,もうこないで……,さよなら……
47,エフィム,1,無,海の果てにある「ワノクニ」に憧れを抱く少年。ワノクニはあまり他の国とは交流が無く、その国独特の文化や思想が生まれているという。父・マーツェから聞いた「ブシ」や「サムライ」の話に心を踊らせ、今日も町のはずれの図書館でワノクニについての研究本を眺める。,がんばらないと！,いつか行くんだ！,これでよし！
48,カロル・プラーナ,2,火,ラビとアーロンの衝突をのんびりと見守っているような青年だったが、過酷な冒険の中で自らも仲間を助けるため進んで敵に挑みかかるようになった。いつかかつての仲間の墓前に花を添えるため、今は心を鬼にしてドラゴンと戦う。,もらった～！,あたれ～！,いくぞ～！
49,キリル・ヴァルナー,2,水,持ち前の魔法の才を生かし、数々のドラゴンを討伐することで大きく名を上げた青年。今では港町の町長として、毎日忙しい日々を送っている。かつての相棒レオニードとの信頼関係はいまだ厚く、ドラゴン討伐の際には毎度タッグを組んで意気揚々と出立している。,運が悪かったな,威勢もそこまでだ,甘いな
50,ブルクハルト・クレスト,2,光,数年に渡る旅路も空しく、ブルクハルトはいまだ「教国」へと辿り着くことが出来ないでいた。ドラゴンを倒しつつ旅をしている彼が、その道中で得た情報によれば、教国はあらゆる土地から断絶し、その所在を知る為には悪名名高き魔女イデアに会う必要があるということであった。,彼女のためにもッ！,負けてらんないんだよッ！
51,シグムント・ストラーフ,2,闇,リュドミラに付き従う魔法使いの青年。もともと少なかった口数は更に減り、普段は村人たちとの交流を一切絶って山の中で暮らしている。ある者が語るところによると、神月の夜にシグムントが呻き声をあげながらドラゴンへと姿を変えたとのことだが、真偽の程は定かでは無い。,ごめん……,いつか…必ず……,これで…きっと……
52,エフィム・ヴァロッツァ,2,無,遠い東の地「ワノクニ」を目指し旅を続けている青年。ワノクニの情報は少なく、辿り着くのは困難だが、その昔一人のワノクニの青年がドラゴンに乗ってこの大陸に上陸したという話を父から聞かされ、自身もその逆を行くべく、ドラゴンと人間が共存するという谷を探している。,絶対行くんだ！,あこがれだけではッ,歩みは止めない！
53,ヨハン,2,火,ドラゴン討伐のために結成された騎士団で剣を振るう若き剣士。同時期に入団したドミニクの鬼のような後輩指導とは対称的に、非常に温和な性格から天使ヨハンと呼ばれ皆から慕われている。ただ、ドミニクの指導方法に理解を持っている唯一の存在で、彼の支えにもなっている。,この場は俺に任せろ！,ざっとこんなもんかな！,力がみなぎってきた！
54,クラウス,2,水,青年騎士団で修業を積み、厳しい試験をくぐりぬけることで晴れて正式な騎士となった寡黙な青年。遠い故郷に、妻と幼い子を残してきており、騎士としての務めを果たし上げたあと、胸を張って帰郷したいと考えている。,仕掛ける！,ただでは帰さん！,守りきる！
55,ミハエル,2,光,同郷のアレクセイと共に、数年前に王都へとやって来た青年騎士。国家資格の中でも最難関とされる王国騎士の資格試験に、いとも容易く合格した若き天才。ただ天才ゆえに、自分よりも要領の悪い者の気持ちが理解できず、周囲との衝突は絶えない。,我の敵ではない！,我が名を刻め！,我が恵みを受けよ
56,エルヴィン,2,闇,病気の弟を救うため、帝国軍へと入軍した剣兵の青年。彼の弟はまだ症例の少ない奇病「竜化症」に侵されており、日に日にその病が体を侵食していっている。病の進行を止めるにはドラゴンのウロコを煎じて飲ませるのが有効であり、その為エルヴィンは最前線への参戦を希望した。,邪魔をするなァ！,やるっていうのか！,ここで止めてやる！
