no,name,rarity,attribute,story,cutin1,cutin2,cutin3
871,[永眠王]フィーア,5,水,フィーアを知らぬ者は居ない。大人も子供も老人すらも、皆が彼女を知っている。しかし誰もが彼女と会った事は無い。彼女は旅を続けているのだ。あらゆる他者の「夢の中」を。彼女は足取り軽く、翼を広げ飛び回っている。故に、彼女を知らぬ者は居らず、しかして現実に相見えることは無い。或いは彼女が現実に存在するのか、フィーア自身もそれを知らない。ただ何百、何千もの年月を経て、今尚夢から醒めることは無く、フィーアは夢の境目で、今日ものんびりたゆたんでいる。,んー、ここどこぉ？,そろそろ眠ればぁ？
872,[解眠王]フィーア,6,水,彼女はあらゆる「夢」を行き来する内、それら数多の夢の中に、共通する「異変」が起こり始めていることに気付いた。異変の主の名は「ドラゴン」。それが、いたる夢中に現れては、破壊の限りを尽くしていた。ただ現れた、というのであればフィーアも取るに足らない夢の住人の一種と見なした。しかし、ドラゴンたちの傍若無人極まりない振る舞いに、夢の中とはいうものの、彼女は自分に、そして何より自分の住む世界に多大な危害を加える其れを、一匹たりとも許しはしない。,二度と起きなくていいよぉ,あれぇ？今何時ぃ？
873,[忌骸王]オルクス,5,火,かつて其の地は豊穣の楽園であった。豊かに実り、民は皆、幸せに暮らしていた。其の地を統べし王は民からの信望厚く、枯れ自身もまた、民たちを信じていた。やがて地を、凶作が襲った。それは何年も、何年も続いた。民は王を信じた。しかし王には、どうすることも出来ない。やがて一人の民が言った。王は何も出来ない、王を信じてはいけない、王が悪い、王こそ諸悪の根源である。民たちは鍬を捨て、槍を持った。その槍は王に向けられた。王は絶望した。終わりの刻が訪れた。,私ハ民ヲ、信ジテイタ,私ノ心ハ、裏切ラレタ
874,[鬼骸王]オルクス,6,火,僅かに実った麦が燃えている。穂につく虫が焼けて落ちる。気がつけば、王はその手に剣を握っていた。足下に、眼前に、麦畑の向こう、広がる眼下のあらゆる全てに、民の亡骸が横たわっていた。血濡れの躯と、虚ろな瞳。かつては王の心を信じ、そののち王を裏切った者たち。王にとって、何より大切であったそれらはもはや、目の前で燃える麦と同じ「塵」と同位の価値もない。そして王は自身を呪った。即ち、全ての「塵」を「塵」と化すまで、この楽園を絶ち続ける、と。,全テノ塵ヲ、塵ニ還スマデ,コノ楽園ヲ、絶チ続ケル
875,[魔工王]キルト,6,光,大衆が見守る中、彼女の処刑が執り行われる。キルトは鞄に荷物を詰める。執行人の足音が彼女の耳に響く。キルトは彼女と出会った日の事を思い出す。彼女は静かに首を振る。キルトは彼女を見送った日の事を思い出す。執行人の掲げた斧が、朱い夕陽に照らされる。キルトは静かに扉を開ける。斧が振り下ろされる。キルトは自身の「裏切り」を、涙を流し後悔する。彼女は目を閉じ、笑みを浮かべた。,魔工じゃ人は……救えない…,これしか道は…無かったんだ,全て……終わった……
876,[失楽王]メリル,6,水,メリルが愛した実の兄。その胸に大きな孔が空き、肺を無くした彼の口から、とめどない血が溢れ続ける。抱きかかえた彼の身体は徐々に熱を失い、やがて瞳は光を喪くす。彼女は彼を愛していた。彼も彼女を愛していた。ただ一度、たった一度の二人の過ち。それはメリルにとっての罪であり或いはかけがえの無い愛の記憶。メリルの瞳の涙が引く。愛した記憶は、しかし「もう」無い。不意に彼女が破顔する。メリルは猫のような奇妙な笑い声を発し、かつて愛した其れを喰らった。,これが神たる者の罰なれば…,…………ニャハッ,さよなら、かつて愛した者よ
877,[孤児王]レオ,6,闇,孤児院の朝は忙しい。まだ日も出てない内に起床。子どもたちの朝食をこしらえる。準備が出来たら子どもたちを起こし、そのあとは、勉強、昼食、夕食、入浴。全てが完了したのちに、子どもたちを寝かしつける。彼と、そして彼女が引き継いだ、その孤児院の一日はそうして終わる。全ての日課を終了しレオは一息をつく。そして日付を確認した。彼がロスト・ブロンド号の仲間と別れてから、その日でちょうど九年が経ち、即ち明日は、彼女の二度目の命日であった。,さて今日の朝御飯はっと…,君との約束を、叶えるよ……,僕は必ず子どもたちを守る…
878,[魔法少女]プリティ・W,6,火,<br class="spacer">過去も未来も、うきうき、ズキズキ！？物憂げ乙女が迫真変身！目指したエモノは逃がさない！縛って、砕いて、頭割る！叩いて潰して肝を抜く！血の海地獄にご招待！マジカルロリータ、プリティ・ウィッチ！！<br class="spacer"><br class="spacer">,お前なんか逝っちゃえ～！,絶対倒してやるんだもん！,ズッドーン！
879,[冴王]サイファー,5,水,国衛騎士団への入団を志願する若き騎士。その選抜試験を受けるため、同郷の出であるシドと共に王都へと参じた。おおよそ年齢に相応しくない知略、並びに観察眼を備え持っており、数々の試験を優秀な成績で通過していく。第一次中間試験である武闘大会においても、その秀でた才にて優勝を勝ち取ると目されていたが、或る黒衣の戦士がそれを阻んだ。戦士の名はカイン。後に唯一無二の友となるサイファーに、今は槍を突きつける彼。その瞳は、どこまでも暗く、澄んでいた。,世界はまだまだ広いなぁ,全ての道は繋がっているんだ,王手、竜取り……かな
880,[冴牙王]サイファー,6,水,騒乱の武闘大会より数カ月後。依然として王都を襲撃したドラゴンの出処は判然とせず、その恐怖の出来事は皆の記憶から忘れ去られようとしていた。かくいうサイファーも騎士団に入団して数ヶ月、日々の訓練、任務に追われ、過ぎたる時に気を取られている暇など無かった、と、或る日、彼に特別な任務が言い渡される。王女マリアの勅命たる、或るドラゴンの討伐。メンバーはサイファーを含め四人。アレン、ルカ、そしてカイン。王都襲撃を阻止した四人が再び集い一同に会した。,僕は自分の信じる道を進む,物事には必ず原因がある,悪いね、チェックメイトだ
881,[影光王]ノアル,5,光,相変わらずのお転婆姫、ジャンヌの捜索にアランとノアルは手こずっていた。急いで見つけ出さなければ午後の調停委員会に間に合わない。二人はいつもの通り、ほとほと困り果てていた。しかしノアルは近頃この日々を、僅かに、否、大層楽しみ始めていた。常に平凡と言われてきたノアル。非凡と言われる者たちの、ジャンヌやアランが放つ光の影は、彼にとって存外心地がよいものであった。決して叶わぬ光への憧れ。そう、あの時まではそこが自身の境界だと、信じていた。,俺には俺の役目がある！,平凡上等！普通で何が悪い！,俺が準備を整えておく！
882,[棄影王]ノアル,6,光,裏通りを走り抜け大通りに出ると、其処には逆光の中、アランの姿が在った。背中を見せる彼の向こうで、不意に倒れる一人の騎士。騎士の腹部には剣が突き立てられている。止まらぬ血の滝。血に仰向けに倒れる騎士。騎士がアランに向かって何かを囁く。平凡なノアルには、それは聴こえない。アランの手が剣を握る。平凡なノアルには、それが視えない。騎士は静かに目を閉じる。平凡なノアルには、それが理解出来ない。そしてアランはジャンヌに突き立つ彼女の剣を引き抜いた。,俺の役目を……俺は棄てる,光を除いて……光に成る,光を影に……影を光に……
883,[黒喰王]スリィ,5,闇,<strong>Secretarea<br class="spacer">===============================<br class="spacer">DEFECT_OCCURRED_IN_RTDSYSTEM<br class="spacer">ErrorCode:0x17146883,0x0000003<br class="spacer">dlrow_dne.exe(223)<br class="spacer"><br class="spacer">Technical information:<br class="spacer">STOP : 0x000003(0x17146883)</strong>,さぁ、面白くなってきたネェ,ニャフフ……,どレどレ味見を……ト
884,[絶喰王]スリィ,6,闇,ハロー、ハロー？はじめまシテェ、通じてまスカァ？まぁいいヤァ、勝手にお伝えさせて貰いマスネェ、ニャフフ、ワタシの名前はスリィ。或いは量産型参号と呼んでくだサイ。わけありましテ、こんな形でお話させテ貰っテまスけど、じゃないトどうにも具合が悪イのでスヨォ。これには深ーイ理由が……ト、イけナイイけナイ、本題に移りますネェ。そちラ様、そろそろこちラの準備が整いまスノで、完了次第、ズバリ丸ごと頂きまス。ニャフフ、それではソの日までサようなラ～。,何れまトめて頂きまスネェ！,ニャフフフフフ！！,どうにも具合が悪イでスネェ
885,[統治王]ババル,5,火,<span style="color:#FF1493"><strong>[GD---- ----の月・--の讃日]p.002</strong></span><br class="spacer">今、この書を開くそなたが、「東の大地」に、引いては世界の全てに、平和をもたらす使者であることを願う。そしてまた、今、この書が開かれているということは、ほぼ確実にワシは勝負に敗北した、ということじゃろう。順を追って説明する。まずワシは「りゃくだつしゃ」のことを調べる内、真なる敵は其れでは無いという事実に行き着いた。故に、計画の初手、それは即ち「りゃくだつしゃ」との和平交渉から始まるものと定めた。,ゆだんしおったな！,じゅんびはよいな？
886,[統合王]ババル,6,火,<span style="color:#FF1493"><strong>[GD---- ----の月・--の讃日]p.008</strong></span><br class="spacer">以上の取引内容によって「りゃくだつしゃ」との交渉に成功したワシは、その足で「西の大地」へと向かった。この計画には「東」「天」そして「西」、その全ての大地の力を結集する必要があった。何れが欠けても計画は失敗に終わる。それほど敵は強大なのである。今の王都を統治する王との面識は無いが、「西」とは元より秘かな交流がある。故にワシは安心しきっていた。だがそれが、まず初めの誤手となってしまった。,こやつめが！,ついてくるがよい！
887,[双王]ヴァリスタ＆ジル,5,闇,俺が目を覚ました時、其処はガレキの中だった。深く暗い谷の底、光はほとんど届かねぇがなぜだか俺の目は周囲の景色を鮮やかに捉えてた。そこで気付いた。俺の身体が機械になってるって。<br class="spacer"><span style="color:#FF1493"><strong>------------------------------------------------------------------------</strong></span><br class="spacer">私が目を覚ました時。其処はガレキの中でした。深く暗い谷の底、光はほとんど届きませんが、なぜか私の目は周囲の景色を鮮やかに捉えていました。そこで気付いたんです。私の身体、機械になってるって。,面倒だッ！まとめていくぜ！,きゃあ！乱暴しないでっ！！
888,[双魂王]ヴァリスタ＆ジル,6,闇,要約するとつまりこうだ。今、俺と旅を続けているコイツ、ジルは俺の中に居るらしい。多分、科学者共が適当にスクラップパーツの斬り貼りをしたせいで、こんなことになったんだろうよ。<br class="spacer"><span style="color:#FF1493"><strong>------------------------------------------------------------------------</strong></span><br class="spacer">まったくどうにも具合がよくありません。私の中に居座っているこのヴァリスタという方。早く出て行って貰いたいものです。それにこの身体……。早く人間だった頃の身体に戻らないと、私、お嫁にいけなくなっちゃう……。,オラオラ 吹っとべぇッ！！,もう！やめてくださいっ！
889,[絶書王]エウレカ,5,闇,注意：閲覧、解放禁止<br class="spacer">封印指定現存規定原書：No.0001<br class="spacer"><br class="spacer">表題：全テノ禁書ヲ絶チシモノ,燃やしてあげる,逝け、この世の全ての命たちよ
890,[滅書王]エウレカ,6,闇,エウレカの目に、全ての事象は虚に映った。決して終わることのない戦い。それは幾千、幾万、幾億続き、そののち再び繰り返される。永遠の輪廻に彼女は囚われていた。否、彼女では無く、もはや世界の全ては空虚な円環に成り果てていた。故にまた、彼女は手にした禁書を灰にする。二度と元には戻らぬよう、二度とは刻を繰り返さぬよう。しかしそれでも繰り返される。時は再び刻み始める。やがて更なる無限を経た後に、彼女はついに決断する。そして世界は、反転を始めた。,滅してあげる,征け、この世の全ての魂たちよ
891,[兵器]V,5,無,注意：閲覧、解放禁止<br class="spacer">封印指定原書：No.9999<br class="spacer"><br class="spacer">表題：全テノ刻ヲ破壊セシモノ,了解……起動確認,全テノ刻ヲ破壊シマス
892,[最終兵器]V,6,無,「α」「β」「γ」「δ」そして「O」。これら全ての解剖、研究によって「V」の基礎的理論は完成した。「O」のように強固な意志を持つことは兵器としての安定性に欠けるため、素体には厳正な審査の上、三十二番街出身の一般女性が選ばれた。この女性を、まずは薬剤を用いた洗脳で文字通りロンダリングし、のち、兵器シリーズ及び「O」の細胞、或いは器官を移植する。また拒絶反応、更には抵抗など見られた場合、即座に脳をバーストする機能も初期段階で組み込まれる。,了解……対象領域ヲ、破壊,全テの因果ヲ……抹消します
893,[執事王]ランスロット,5,闇,時計の針が時を刻む。その秒針が一を告げるたび、全く違わぬ速度にてランスロットの歩みは進む。手には朝食。幾千年も以前から主はろくに食べもしないが、それでも毎日きっかり同じ品が、その手に持った銀盆に、色とりどりに並べられる。広大な館に、盆と食器の音が鳴る。床に散り、行く手を遮る本を踏みつけ、懐中時計に目をやれば、起床時間まで残り一分。一秒たりとも狂いは無い。やがて主は、白き執事がいれた茶の香りに誘われ目を覚ます。そして禁書館の一日が始まる。,間抜け……でございますね,グッド……でございます
894,[司筆王]ランスロット,6,闇,幾つもの時計が幾つもの時を刻んでいる。刻の音に耳を傾けながら、ランスロットは主が使うペンの手入れを行っていた。主は一冊の書を仕上げる際、あらゆる種類のペンを用いる。それは書に描かれる情景が、あらゆる時代を映し出す為である。全てを繋げ、帰結させる。それを生み出すペンの手入れにランスロットは誇りを持っていた。擦れぬよう、持ちやすきよう。故に、ペンを粗末に扱ったり、あまつさえ壊そうものなら、主といえど、ランスロットは全く、全然、容赦しない。,ボンクラ……でございますね,グレイト……でございます
895,[嫌書王]ラウル,5,火,ラウルはとにかく書を嫌った。文字を連ねた巨塊の虚構、嘘を重ねた醜き真実。いずれにしても、そこに確たる世界は無く、書き手と、そして読み手が望む世界だけが、ただただ無意味に広がっている。一見とても広いようで、果たしてとても狭い世界。ラウルはそれを好まなかった。だが、それは好まぬ理由であったとしても、嫌う理由になりはしない。彼が数多ある書を嫌う理由。それは養父の、即ち世紀の出版王たるダルタニアンの存在にあった。,さぁ、勝負ですッ！,命乞いなら聞きませんよ！,燃え尽き灰になりなさい！
896,[憎書王]ラウル,6,火,ラウルの家は、古くからある名門の貴族であった。王都からの信頼も厚く、また周辺にある村や街からの評判も、好意的なものが主であった。しかし或る時、或る書が出回る。それはある貴族の繁栄と、その裏にある不正を暴く、取るに足らない三文小説であった。創作であり、ただの空想。しかしその書は、瞬く間に売れ、広まった。やがて一つの噂が立つ。その貴族には「元」が居ると。果たしてラウルの家は地に堕ちた。そして書の著者、ダルタニアンが、幼きラウルを引き取った。,いざ尋常に、勝負ッ！,観念しなさいッ！,灰すら燃え散り消えなさい！
897,[指揮王]ジョエル,5,水,夜だけが、彼らにとっての安らぎだった。病弱だった幼きジョエルは、伏せる床で兄から様々なことを聴き、教わった。世界のこと、音楽のこと、本のこと、そして「禁書」のこと。兄の話は、いつもジョエルの心を弾ませた。夜明け前、空が白み始めるその直前まで、毎日ジョエルは話をせがんだ。が、その地下室の扉が開く。ジュエルは静かに立ち上がる。手と足と、首から下がる鎖を鳴らし、ジュエルはそこから連れられていく。不安げな弟を安心させる、優しい笑顔を傾けて。,さぁ……協奏曲を奏でよう,僕が必ず兄さんを……,兄さん兄さん兄さん兄さん！
898,[識王]ジュエル,6,水,夜明け前。最も暗いその時刻、ジュエルの両手は濡れていた。足元には男と女、そして彼らの子供の五人が在った。既にその身に温もりは無く、皆一様に、夜の深い影に溶けている。病気であった弟が、この世を去って２１日。ジュエルの体には、数多の文字が彫られていた。弟の身長、弟の体重、弟の生涯。病気以外の弟の全てが、彼の体を覆ったその日、彼らの邪魔をする者は消え、そののち、ジュエルは深い眠りについた。そしてジョエルが目を覚ました。,さぁ……狂想曲を奏でよう,良い音で泣いておくれ,全く出来の悪い……弟だ
899,ファーゴ,4,火,自身が書から生み出されたことを、ファーゴはまったく悲観しない。それは彼がそのように「個性」を設定されているからでもあり、或いは彼が辿り着いた、一つの答えの果てでもある。即ちファーゴは「今」を生きる。己の過去がどうであろうと、そして未来が明るく無くとも。むしろ、であればこそ彼にとって、今、その刻こそが宝となる。生まれたことに、生きることに、果たして如何なる意味も無いからこそ。ゆえに、ファーゴは奏で始めた。一期一会の、音に会うため。,僕は、今を、生きる,イエス　マスター,この音を奏でる
900,第一奏者ファーゴ,5,火,五人。クインテットの面々が、音を奏で、合わせる。果たしてまったく統率無く、音はぶつかり周囲に散らばる。やがて演奏が止み、その空間を静寂が占めた。と、ふと笑い声。その静けさを破ったのは、五人を束ねるフルトであった。彼女のそれを皮切りに、五人は一斉に笑い出す。自身の拙い演奏を、五人の拙い合奏を、しかし五人は楽しんでいる。ファーゴはとても嬉しかった。彼が四人に声を掛け、そうして叶った「今」。その「今」は、その時、確かにそこに在った。,僕は、今を、奏でたい,イエス　マエストロ,これは「今」の音
