no,name,rarity,attribute,story,cutin1,cutin2,cutin3
801,[蜘焔王]パプリカ,5,火,世界の何処かに存在するという、この世の全ての魔導書が集う「禁書館」。広大なる館内のその一角に、或る時一匹のクモが棲み着いた。正確には元々人であったそのクモもどきは、毎日本を読んで暮らした。ページを捲るは風の気まぐれだったが、様々な書の断片は彼にかつての記憶を思い起こさせた。一日の終り、彼は必ず架空の日記をつけた。それはクモの糸で紡がれた、脆く儚いものであったが、やがて連なり膨大な量になる。即ちそれが、パプリカを生む「魔導書」となった。,私の焔にお気をつけください,振り落とされぬようご注意を,私が全力でお守り致します
802,[蜘緋王]パプリカ,6,火,或る朝クモが目覚めると、そこに彼女は立っていた。パプリカと名乗るその女性は、自身がクモの紡いだ「魔導書」から生み出された存在だと語った。あまりに突然の事に驚くクモだが、そんな事には構い無く、彼女は彼を肩に乗せる。再び驚くクモに対し、パプリカは言う。主の体を取り戻しましょう、と。それが三度目の驚きであった。物言えぬクモの、しかし心は湧き立つ。だがそれ故に、その時彼は気づいていなかった。八つある足の一つが石の如く動かなくなっている事に。,私の毒にお気をつけください,焼け朽ちぬようご注意を,全て私にお任せください
803,[傭兵王]サンダース,5,闇,未来における戦争では主に二つの勢力が覇権と己の威厳を掛け、永きに渡り争い続けていた。機械や人工知能によって人類の新たなる進化を追い求める「第七帝国」とそれに反する「王律軍」。両者の戦力はほぼ互角。人を素体とした半人造の兵士や完全機械の戦争人形なども誕生したが、何れも終戦への決定打には成り得ていなかった。そんな中、恥もかつての名誉すら捨てただ金の為だけに戦に参ずる集団がいた。その集団「VULTURE」の隊長こそかつての英雄サンダースである。,旅立ちの準備はいいか？,こちとら遊びじゃ無いんでな,作戦フェイズ27発動 アウト
804,[大佐王]サンダース,6,闇,見上げれば今日も空は曇っている。度重なる戦争によって焼け朽ち、汚染れた大地から舞う「黒き灰」は、厚い膜と層とを成し、世界の大半を覆っていた。サンダースは指に挟んだ煙草をくわえ深く息を吸い込む。彼が率いる傭兵集団「VULTURE」は今、雇い主たちの依頼にて、その標的と対峙していた。なけなしの食料と、僅かな水。今、目の前で翼を広げる凶悪な「竜」の討伐には少し安すぎる報酬だったかもしれない。しかしそれでも煙を吐いた口元に、確かな笑みが浮かんでいた。,誇りを捨てた覚えはないな,報酬、確かに受け取った,目標爆撃 座標2289 アウト
805,[給仕王]エスタ,5,水,王国にほど近い海岸。そこにある「虹色食堂」にて、エスタは給仕、及び食材の調達を担当している。決して人前に出ない料理長とは店に勤めて以来扉越しに話をするのみであったが、それでもその料理がエスタの心を掴んで離さなかった。しかし或る時、料理長を不調が襲う。やがて一切の料理が創られなくなった食堂は、一時休店を余儀なくされてしまった。このまま店が無くなる事、そしてそれ以上に料理長の料理が絶たれる事を危機と感じたエスタは意を決し厨房への扉を開いた。,ごっつぁんですッ！！,いっただっきまーす！！,こいつ食べられんのかなー？
806,[食達王]エスタ,6,水,真紅のドラゴンを仕留めつつ、エスタはその日六度目、通算千百二十四度目の溜め息をつく。休店状態にある「虹色食堂」の厨房に足を踏み入れたエスタを待っていたのは、料理長の不在、そして一通の手紙であった。そこには一言「七色竜を探しに行きます」とだけ。そのようなドラゴンの存在すら耳にした事の無かったエスタだったが、瞬間やるべき事は悟っていた。即ちそれこそ料理長の求める食材。そして食材調達の意地と誇りを掛けた、七色竜を探す長い旅が始まった。,ごちそうさんっ！！,大地の恵みに感謝しますッ！,さてこいつの調理方法は……
807,[占星王]キララ,5,光,<span style="color:#FF1493"><strong>[GD4988 一の月・光の讃日]</strong></span><br class="spacer">んー、くらくてなにも見えないでゆ。もしかしたら、こわれちゃってゆのかもしれない……。せっかく今日はお星さまが見えゆと思ったのにざんねんでゆ。お星さまが見れないとなんにも未来が見えないでゆ！困ったなぁ……。このあいだから、なんだかあんまりよくないお星さまの巡りな気がするでゆ。あ、そうだ！トトユならなおせゆかもしれない！あしたたのんでみゆでゆ。たのしみでゆ。,なにもみえないでゆー,まっくら！
808,[綺羅王]キララ,6,光,<span style="color:#FF1493"><strong>[GD4988 十五の月・光の讃日]</strong></span><br class="spacer">んふふ、やったでゆ。直してもらったでゆー。これでお星さまが見れゆでゆ！王さまからいそいで未来を見ておくれとお願いされていゆので早く見てみないとでゆね。あ、そうだ！でもトトユにお礼してこなきゃ……。あ、でもそれは後からでも大丈夫でゆね、たぶん。王さまからのお願いの方がきっと大切なはずでゆ！決してお星さまをいちはやく見たいとか、そういうことでは無いでゆよ！んふふ、では、さっそく見てみゆでゆ！,きれいなお星さまでゆー,きらきら！
809,[天機神]ディラル,5,光,注意：閲覧、解放禁止<br class="spacer">封印指定原書：No.0013<br class="spacer"><br class="spacer">表題：神ノ鎖ニ縛ラレシモノ,次はてめぇが血を見る番だ,俺に指図するんじゃねぇ
810,[天騎神]ディラル,6,光,「バベル」に幽閉されし神、ディラル。彼はそのあまりの邪悪さ、そして凶悪さから古の神々によって封印されていた。その封印は数千年の間、一切破られる事無く、また解かれることなく固く閉ざされている。しかし今、その扉に手を掛ける者が一人。これで全ての「鍵」が揃う。或いは「駒」というべきか。七つのオリジン、そして三つの古神。これらの破片をもってして、この世の竜の全てを滅し、神に代わって世界を統べる。それこそ彼ら「帝国」の、唯一絶対なる目的。,てめぇら全員八つ裂きだ,これで俺を縛ったつもりか？
811,[造鉄王]ヴィルダー,5,火,ここに「魔剣」に関する全てを記す。この魔剣に名は無い。理由は二つ。一つ、これは所持者の心の有り様によって、剣にも、盾にも、鎧にも姿を変える。故に定める形は無く、故に定める呼び名も無い。二つ、私が、私の打った戒器に名を付けぬのは、後にも先にもこれのみである。それ程に私はこの剣を憎む。私はこれを呪われし魔剣とし、此処、神の山嶺の地下深くに、この書と共に封印する。そして願う。二度と誰の手にも渡らぬことを。<span style="color:#FF1493"><strong>[P.003]</strong></span>,おめさん、すまんな！,だから、駄目だっつってっぺ！
812,[鍛冶王]ヴィルダー,6,火,私は妻の死に目には、立ち会えなかった。娘を産んで一日も経ってない間に、私が駆け付けるその前に、妻は逝ってしまった。それが「魔剣」が私にもたらした「不幸」だった。この「魔剣」は、絶対的な力と引き換えに、所持者に必ず不幸をもたらす。そして、それは所持者の命が尽きるまで、無限の如くに集い、続く。だから私は何度も魔剣を手放した。しかしそれは、どう尽くしても必ず私の元へと還ってくる。だから私はこの奈落の底で、この書と共に眠ると決めた。<span style="color:#FF1493"><strong>[P.682]</strong></span>,通してくれ、おめさん！,ごじゃっぺなやつだな！！
813,[同位六号]クロ,5,闇,オラクルの同位六号、その半分を形成する存在。失敗作として処分されることが定められていたが、片割れである白き魂の手引きによって刻の牢獄から脱するに至った。元々は「魂」だけの存在であったが、奈落の底にて息絶えていた者の体に定着することで、活動可能範囲を増加させている。オラクルとしての性質はほぼ失われており、体を得た事と同期し明確な自我を持った。故に、その精神的特性は元の体の持ち主のそれに近い。,チッ！邪魔すんじゃねぇ！！,くそッ！こっちは急いでんだ,蹴散らすぞッ！！
814,[刻眼王]クロ,6,闇,「刻の魔眼」の力を覚醒させた同位六号。尚、魔眼の力は時間移動を可能とするがそれは自由自在なものでは無く、あくまで一部の刻の牢獄へと通ずる事が出来るに留まる。力を活かし世界に散るオラクルの同位を全て抹消せんとした彼は、黒き竜と共にあらゆる時代を旅し、刻の眼を操る竜王として各地に様々な伝承が残されるに至った。しかし最期は竜ともども「帝国」に捕らわれ、その体は刻みつくされ「或る兵器」を蘇らせる為の素体となり、後に残るは魔眼のみであったという。,邪魔だ、どけぇッ！！,くそッ！もう時間が……無い！,かまってる暇は無ぇ！！
815,[同位六号]シロ,5,光,「白凛竜」が生み出した擬似生物「オラクル」の不完全体。魂の融和が完全では無く分離してしまった事で、その構造特性が既存のそれとは大きく異なり、他のオラクル、また母親である白凛竜からは、決して同位として認識される事は無い。本来であれば即、処分される対象であるが、六号の場合においてはその分離した「黒き魂」が逃亡した為、その魂を導き出す手段として、刻の牢獄に囚われ続けたままとなっている。,刻を、壊す、母,刻も、いずれ、消える,刻に、巡り、祈る
816,[完同体]オラクル,6,光闇,「白凛竜」が生み出した擬似生物。魂を持たず、母体である白凛竜からの定期的な供給を受けることでその命を永らえている。同位の個体が数十存在するが、個としての意志を持たず、母体を含め全てが意識を共有している。白凛竜が存在する限り、数を無限に増やし続けることが出来、また且つオラクルが一体でも生存している限り、その存在地点を鍵として白凛竜は何度でも復活することが出来る。尚、かつて個体数が数千に及んでいた頃は「白竜人」なる種族として認識されていた。,全号ヘ告グ、餌発見,汝、母ノ餌ト成レ
817,[飛艇王]オルガ,5,水,「A・スミス貿易真社」。世界の航路、裏交易の全てを掌握するその組織には「五豪」と呼ばれる五人の幹部たちが存在する。何れも、組織の頭目ギルバ・アポロースに忠誠を尽くす者たちだが、そんな中にあってひときわ忠誠心の高い者が居た。それが誇り高き、疾風のオルガである。彼女はギルバが所有する三船の一つ、天を征く船「ロスト・レイン号」の全権を任されており、其れによって大空を駆け巡っていた。今でも疼く、羽根を喪くした痛みを抱えて。,あの方が、私の全て,疾風に、恐怖しろ,貴様も羽根を喪うがいい
818,[望空王]オルガ,6,水,彼女は昔、空を喪くした。「西の大地」の者たちは彼女を捕えると、地獄のような日々の末、風きり羽根を切り堕とした。鳥と異なり、神経も、そして血管も通る其れを、錆びた刃が切断すると、想像を絶する痛みと血の飛沫、そして己の叫びが彼女自身に降り掛かった。荒い呼吸、止まらぬ涙。痛みの為だけでは無く、二度と空を飛べぬという、絶望、或いは諦念がオルガの心を圧し潰す。彼女の眼は既に、光を失いかけていた。しかしその時、彼が、一羽の鳥と共に姿を現した。,尽くす、私の全てを,疾風を、見せてやる,貴様の羽根を斬り堕とす
819,[黒王]ジュリエット,5,闇,「咎人」と呼ばれる者たちが集う組織「黒の牙」。その組織の長クロノの直属の部下がジュリエットである。ただ、彼自身は咎人では無い。或る魔眼を移植され意思を持った彼の槍が「禁器」に指定されたことで、その所持者たるジュリエットは必然的に咎を背負いし者となり、組織に参入することとなった。常に叩く軽口と、風貌の印象から、組織一「軽い男」として認知されているが、その槍、即ち相棒の「カノッサ」を操る実力は一流であり、ゆえにクロノの信頼を得るに至った。,やっべ、遅刻しちまうッ！,こりゃ先輩にドヤされんな,出番だぜ、カノッサ
820,[密黒王]ジュリエット,6,闇,月が沈む頃、朝日が空に昇る前、真に暗い闇の中、組織が拠点とする城の屋上にジュリエットは居た。無線の周波数をいつも通りの数字に合わせる。雑音に交じり微かに聞こえてくる女の声。ジュリエットは幾つかの、仮に他人が聞いたとしても意味の通じぬ言葉を女と交わす。やがて会話は終わり、無線からは耳障りな雑音のみが流れ続ける。昇り始めた朝日の光に相棒が目を細める中、帝国軍第零大隊副隊長ジュリエット・ロウは、潜入任務の終わりの刻を、一人静かに予感していた。,まーた先輩にドヤされちまう,はいはい了解ッと,頼むぜ、カノッサ,先逝ってますよ……先輩
821,[犠王]ジーク,5,闇,ジークの心は穏やかである。風の無い水面のように波立つ事は決して無い。彼の素顔は数多の傷に覆われており、身体には無数の傷が刻まれ、体内にはいまだ幾つかの鉄片が埋まっている。ジークに何があったのか。しかし彼が過去を語ることは無い。それを聞いても誰も何も得ぬからだ。むしろ要らぬ怯えを与えてしまう。ジークは、他者が心を痛める事を嫌った。痛みを得るのは己一人でもう十分。それがあの時、幼き頃に誓った約束。そして今日もまた新たな傷が彼の体に刻まれる。,俺を……殴れ……,俺の体は……痛まない
822,[犠己王]ジーク,6,闇,少女が前を走っている。幼い彼は必死でそれを追いかける。警報が鳴り響き、紅い光があちらこちらで廻転する。見張り台から、二人目掛けて鋭い光が当てられる。駄目だよそっちに走っていったら。幼い彼が声を上げる。少女は構わず走り続ける。走る。奔る。疾走る。少女まであとわずか。彼と彼女の手と手が触れるその直前、足下からカチリと音がし、それきり世界は音を消した。無数の鉄片、少女の体が弾け、舞い、飛び、幼い彼はそれっきり、大人になるまで目覚めなかった。,俺を……斬れ……,俺の心は……痛まない
823,[美鏡王]ラビリス,5,火,ラビリスは、その日も鏡を眺めていた。母の形見<br class="spacer"><span style="color:#FF1493"><strong>世のこてした満をしたわが光なんへすまい呪は私</strong></span><br class="spacer">のその手鏡には特異は特徴がある。その鏡の中に<br class="spacer"><span style="color:#FF1493"><strong>い追に界世のこを私は私界世のこいた出は私に界</strong></span><br class="spacer">は、常に美しい景色が広がっていた。それは鏡で<br class="spacer"><span style="color:#FF1493"><strong>由理。れこにめ始手のそるす讐復にちた人ためつ</strong></span><br class="spacer">あって、鏡で無い。鏡に映る自分はそのまま、し<br class="spacer"><span style="color:#FF1493"><strong>。すで私るす代交と女のこいなしはし許い無は</strong></span><br class="spacer">かし景色は、全く異なる風景を映し出していた。,とても美しい……世界,此処以外なら何処でも良い
824,[幽鏡王]ラビリス,6,火,ラビリスは、その日も鏡を眺めていた。今日も、<br class="spacer"><span style="color:#FF1493"><strong>んこ。てし出らかここを私、か誰。いた出、だ嫌</strong></span><br class="spacer">鏡の中には美しい風景が広がっている。飢えも、<br class="spacer"><span style="color:#FF1493"><strong>けなま望どな界世の中の鏡、らなのるなにとこな</strong></span><br class="spacer">争いも、音も、匂いも、鏡に映る自分以外の何者<br class="spacer"><span style="color:#FF1493"><strong>話に私の中の鏡、時のあ、日のあ。たっか良ばれ</strong></span><br class="spacer">も存在しない、ただ美しいだけの世界。ラビリス<br class="spacer"><span style="color:#FF1493"><strong>。たっかよばえましてっ割を鏡、時たれらけかし</strong></span><br class="spacer">は、鏡の中の自分に向かって、不気味に笑った。,界世……いし美もてと,讐復の私るま始らかここ
825,[執事王]ガウェイン,5,光,時計の針が時を刻む。ガウェインは主の為にいれた茶を運ぶ。館は広大であり運ぶ間に茶は冷めてしまうが主の舌にはそれがちょうど良い。既に何千年もの間、主の世話を行ってきたガウェインにとって茶の温度の完璧な調整などは、もはや歩く事とほぼ同義といって良いほどの事に過ぎない。軽やかな足取りで床に散らばる本を避け、主の突っ伏す机に辿り着く。起床時間まで残り一分。一秒たりとも狂いは無い。やがて主が茶の香りに誘われ目を覚ます。そして禁書館の一日が始まる。,どうかお引き取りください,承りました、我が主
826,[司書王]ガウェイン,6,光,幾つもの時計が幾つもの刻を刻んでいる。刻の音色に耳を傾けながら、ガウェインは書類の整理を行っていた。主は一冊の書を仕上げる際、あらゆる過去の書に目を通す。ほんの僅かな狂いも無きよう、あらゆる過去が繋がるよう、針の穴に糸を通すかの繊細さで、数多の本は紡がれて来た。その仕事にガウェインは最大限の敬意を払う。紙が破れぬよう、表紙に傷がつかぬよう。例え、如何に本が散らかっていても、如何に山羊づかいが荒くとも、ガウェインは全く、全然、気にしない。,ティータイムにはまだ早い,かしこまりました、我が主
827,[騎士長]リリア,6,火,<span style="color:#FF1493"><strong>[GD---- ----の月・--の讃日]</strong></span><br class="spacer">幼い頃、私はとても弱かった。だから父から貰った首飾りを失くしてしまった時、ずうっとずっと泣いていた。それを見て優しかった母は、代わりに母が大切にしていた首飾りを私にくれた。でも私は泣き止まない。それでは嫌だと駄々をこねた。母は怒らず、そうっと笑顔で私を撫でて言った。明日までには見つけてくるね、と。それまでこれで我慢してね、と。それを聞いた私はやっと泣き止んだ。でも次の日、母は帰ってこなかった。,私はぜったいつよくなる！,えいっ！！
828,[凛烈姫]リリア,6,火水,<span style="color:#FF1493"><strong>[GD---- ----の月・--の讃日]</strong></span><br class="spacer">そして時が経ち、私は強くなった。泣かぬと決めたわけでは無い。それでも二度と私は泣かない。母が残した「夢」と「希望」。それを叶えるその時まで、私は絶対、下を向かない。この国の王、すなわち父と、そして母が共に思い、描いたその風景。母を奪った「りゃくだつしゃ」たち。その手から「西の大地」を取り戻し、此の地の皆が安心して暮らせる世界を築く。母の想いは私が継いだ。母のため、必ず「理想」にたどり着く。,私はぜったいあきらめない！,泣くな！たて！下をむくな！
829,[敗北神]ゴッドフリー,5,闇,神は全てを平等とした。それがゴッドフリーの持つ唯一絶対の理念であった。優劣の無い、平等な世界。信じた世界は、しかし果たして幻想であった。かつて自身と同位であった神々は、いまや全てが上位に居り、或いは下位の神ですら、その幾人かはゴッドフリーの上に立つ。皆がささやく。負け犬、と。皆がささやく。神に非ず、と。己はなにゆえ負け続けるのか。どうして誰にも勝てぬのか。ゴッドフリーにはそれが分からず、ゆえに優しき彼の心はやがて静かに、軋み始めた。,優劣などつけるべきじゃない,勝つも敗けるも無駄なことだ,全てのものに平等の理を
830,[征勝神]ゴッドフリー,6,闇,全てのものに打ち勝つ原理。それこそゴッドフリーが核とする、唯一絶対の定義である。あらゆる敗けを刻み続けた彼が、或る時ついに達した解。それは己が全てに打ち勝つことで、その他全てを平等とすることであった。勝者は常に一人で良い。己一人が全てに勝てば、自ずと他者は敗者となる。そして優することも、劣することも、やがてゴッドフリーの前においては、如何なる意味も持たなくなる。そして世界を平らに戻すため、彼は唯一絶対の力を求めた。,我は、神の上に立ちし者ッ！,勝敗など私の前では無意味！,等しきへと尽き果てろッ！！
831,[武王]ショーグン,5,光,<span style="color:#FF1493"><strong>[ご依頼募集中！！]</strong></span><br class="spacer">武力衝突でお困りですか？<br class="spacer">代理戦闘、抗争鎮圧、喧嘩仲裁ならJASON社にお任せください！<br class="spacer">徹底された戦闘ノウハウ＆戦闘後の設備補修アフターケアまでを含むワンパッケージプラン！<br class="spacer">今なら既存兵の育成もサービス中！<br class="spacer">この機会にぜひ一度お問い合わせください！<br class="spacer">お問い合わせ先[西パンザイル３-５３５],まったく損な役回りだぜ,ま、仕事だから……な
832,[闘争王]ショーグン,6,光,その夜、彼は街の外れにある店の椅子に座りグラスの中の液体で喉を潤していた。否、最近の「西の大地」から持ち込まれるようになった其れ、即ち「酒」と呼ばれるものは、喉を潤すというよりも、焼くと表現するのが正しい。暗い照明、静かな店内。なめるようにして酒を飲んでいた彼、即ち便利屋ジェットは、果たしてある調査依頼を遂行中であった。店の隅、静かに酒を呑むターゲット。ショーグン、とそう呼ばれる者の監視中、しかし突如に響く数多の銃声と共に事は起きた。,まったくトラブル続きだな,俺はもう見定めちまったのさ
833,[ものしり]グルル,5,闇,<span style="color:#FF1493"><strong>[グルル百科：ゼレスケ形のゼーリィレシピ]</strong></span><br class="spacer">ゼレスケ形のゼーリィを作るには、結露した水晶<br class="spacer">の器を用意する。それに粘化した果汁を煮進めた<br class="spacer">物を注ぎゼラーチを混ぜる事によって下ごしらえ<br class="spacer">は完了。他の果物を入れる場合は生の物を入れる<br class="spacer">ことを奨める。ぼくはその後、再度ゼーリィを器<br class="spacer">ごと火にかけ融かす事で、あの独特の型へ適合さ<br class="spacer">せる事に成功した。果物とゼーリィの味の融合に<br class="spacer">際限は無い。だが条件がある。それは掛け合わせ<br class="spacer">る果物が「西の大地」のものであるという事だ。,ふぅむふむ……,実に興味深い研究対象だ
