no,name,rarity,attribute,story,cutin1,cutin2,cutin3
834,[はかせ]グルル,6,闇,<span style="color:#FF1493"><strong>[グルルめも：暗号解読鍵]</strong></span><br class="spacer">●●●●○●○○○○○○○○○○●○○○○●<br class="spacer">○○○○○○○○○○○○●○○○○●○●●○<br class="spacer">○○○○○○○○○○●●●●●●○○○○○<br class="spacer">○○○○●●○○○○○○○○○●○●○○○○<br class="spacer">○●○○○○○○○○○○○○○○○○○○○○<br class="spacer">○○○○○○●○○○○○○○○○○○○○●●<br class="spacer">●●●●●●●●●○○○○○○○○○○●●●<br class="spacer">●●●●●●●●●●●●●●●●●●●●●●<br class="spacer">●○●●●●●●●●●●●●●●●●●●●●,なるほどなるほど……,すべては僕の想定内さ！
835,[琥王]アンバー,5,水,<span style="color:#FF1493"><strong>[ご依頼募集中！！]</strong></span><br class="spacer">潜入、侵入お任せあれ！<br class="spacer">大企業から極秘基地まで、いかなるスキーニングミッションもJASON社なら安心！<br class="spacer">現地入りから目標達成までの最短、最善プランをご提案！勿論、行き届いた証拠隠滅で一切の痕跡は残しません！<br class="spacer">ただ今、特別無料相談会を実施中！<br class="spacer">まずはお気軽にご相談ください！<br class="spacer">お問い合わせ先[西パンザイル３-５３５]　,これで一件落着ね,探し物があるだけ……よ
836,[琥珀王]アンバー,6,水,あの日から。全て奪われ、失くした刻から彼女の心は何も言わない。与えられる任務は、全てが退屈そのものだった。ゆえに彼女は、手段を問わない。手を汚し、身体を汚し、心を汚し、あらゆる任務を遂行する。しかしそれでも、彼女の刻は固まったまま、少しも何処へも動かなかった。一切の感情は表に出ず、そして心は更に固く。やがて組織は、幼き彼女に名を与えた。コードは「U」。永久に埋められたその魂。土の中、囚われ続ける「アンバー」と、彼女はそれよりそう呼ばれた。,求めることこそ、生きる意味,私の心が、そう言ってる
837,[白妙王]ハクヒ,5,光,ワノクニと呼ばれる大陸がある。その全土を統べる都「大和」にてハクヒは帝に仕えていた。先の「神」との大戦にて人々に勝利をもたらした英雄の名を冠する都。その中心「始聖宮」では、いまだ戦の傷跡が残る大陸全土の復興のため日夜、議論が為されていた。無論それを束ねるのは帝であり、ゆえに帝は文字通り不眠不休の時を過ごしている。ハクヒにとってそれが不安の種であった。もし帝が倒れれば再びこの地は乱世へ陥る。果たしてこれより僅かの後、彼女の予感は的中する。,平穏の世を、護るために！,この剣は、帝の為に！,黒き闇、永遠の牢
838,[白銀王]ハクヒ,6,光,ハクヒは山を登っていた。かつて神の使徒が棲んでいたというその山は今、あちこちから吹き出す蒸気によって常にもやがかり、帝によって立ち入りが禁じられた領域となっていた。だがハクヒを含め数人のみが知る「伝説」がある。倒れた帝に代わるのは最早その「伝説」でしかあり得ない。と、不意に視界が晴れ、思わずハクヒは顔を上げる。道の先には男の姿。岩の上に胡座をかき、口にくわえた煙管から紫煙が漂う。まごうことなき剣神の、二十年来変わらぬ姿が其処に在った。,白銀の座、参ります！,この剣で悪しきを断つ！！,黒き業、悠久の鎖
839,[怪盗王]ジョイ,5,闇,神出鬼没、変幻自在。お宝眠るあらゆる場所に現れては、いかなる罠や、どんな仕掛けもくぐり抜ける。それが世紀の大怪盗、ジョイであった。ジョイという名は、闇夜に浮かぶ彼の仮面が喜びに満ちた表情である事から大衆が付けた呼び名であり本名では無いのだが、元より自身の名を知らぬ彼は、それを気に入り受け入れていた。たとえどんなに追いつめられても、その状況をすら楽しみ笑う。それこそ彼の信条であり、即ち、盗むものへの彼なりの最大限の礼儀でもあった。,うん、面白いお宝だ,キミには到底盗めやしないさ,あっという間の出来事さ
840,[快盗王]ジョイ,6,闇,月のない夜、王宮、堀の上。暗闇の中にジョイは居た。強めの風が首に巻かれた布を揺らす。今宵盗み出すのは黒き至宝「ブラック・ダリア」。王宮の地下深くに眠るという其れは、いまだかつて誰の目にも触れた事が無いと云い、果たして如何なるお宝か、ジョイは期待に胸を膨らましつつ敷地内へと侵入した。が、しかしその時、不意に視界に少女の姿。見れば彼女を追う騎士二人。面倒事を背負い込んでしまったと後悔するのは、彼が二人の騎士を蹴り飛ばした後のことだった。,こりゃまた難儀なお宝だね,必ずボクが盗んでみせる,ほらほら、隙だらけだよ？
841,[採集王]アオ,5,水,<span style="color:#FF1493"><strong>[採終日記・ハツシチオオムシ]</strong></span><br class="spacer">ハツシチオオムシ。別名「虹色妃蝶」は、七色に輝く羽根を持つ世にも美しい蝶だ。そもそも「蝶」と定義されるムシは、そのあまねく全てが希少種だが、こいつはその中でも更に突出した希少種であると言える。なぜならこれまで世界で２０頭程度しか捕獲されておらず、かつそれらも全て、短い寿命の為に既に生存していない。つまり、ようやく見つけたこの群れが、今、俺の目の前で燃え散るこれらが、恐らく最期の虹色妃蝶だろう。,さあ、採集の時間だ,お前の種も絶ってやるよ
842,[採終王]アオ,6,水,<span style="color:#FF1493"><strong>[採終日記・剣鰐種]</strong></span><br class="spacer">剣鰐種。剣のように鋭い牙を持ち、あらゆる物を砕くその強靭な顎は、まさに時代遅れの野蛮な獣の成れの果てと言える。だがこいつらが獣と最も異なる点は、生意気にも言語を理解し、曲がりなりにも文明的な生活を営んでいたということだ。だが、それももう終わる。火を着ける前に、鱗と牙は全て奪った。生きた個体は俺の趣味ではない。まぁ、どちらにしろ、ギルバにとってはどうでもよいことなんだろうが。,さあ、採終の時間だ,お前の終わり、俺に寄越しな
843,[郵便王]ナディア,5,闇,私が「函」を辞めてから、おおよそ一年ちょっとが経った。「函」には毎日たくさんの手紙が届く。分別されたたくさんの其れを、世界の各地に届けるのが「函」に仕える「便り鳥」たちの仕事だ。私も昔はたくさんの手紙を、世界各地に運んでいた。文字が詰まった想いの欠片。それを届けるその仕事を、私は何より誇りに思っていた。でも、ずっと心に引っかかってた。蒼い郵便箱。そこではいつも、読み手を失くした、即ち「宛先不在」の手紙たちが、廃棄の時を待っていた。,ご、ごめんね？,想いを届ける、その為に！
844,[幽便王]ナディア,6,闇,今日も私の家の「蒼い郵便受け」には行き場の無い手紙たちが、いっぱい、たくさん詰め込まれていた。読み手を失くした手紙たち。「函」を辞めた私は、世界中の「宛先不在」の手紙を引き取ることに決めた。「宛先不在」。つまりそれは受け取る者が既にこの世に居ないことを表している。代わりに託す家族も知人も居はしない、そんな孤独の手紙たちを私はしかし、届けることに決めたのだ。読むはずだったその主が、最期に眠るその場所まで、どんなに刻が掛かっても。,ごめん、通して！！,全ての想いを、必ず届ける！
845,[虚獣王]ロア,5,火,雨に打たれ、濡れる体、震える手足。ロアは逃げて来た。恐ろしき牢獄で、親も、仲間もみな死んだ。その地獄から脱して、どれほど走ったことだろうか。気づけば、その貧しき街の片隅で、ロアはうずくまっていた。凍える呼吸、吐く息は白く、か細い。臆病な自分。親も仲間も見捨てた自分。こんな世界に、或いは己に、全てを憎み全てに復讐を誓ったその時、しかし目の前で案山子のお化けが嘲笑っていた。それが、ロアの最も古い記憶。幼き頃の、始まりの思い出。,チカ……ヨルナ……,貴様ヲ……咬ミ殺シテヤル！
846,[隻獣王]ロア,6,火,燃え盛る炎の矢がロアを襲う。右、左、左、上。寸での所で回避に成功。幾本かの矢がたてがみを擦った。あまりに正確無比に避けていると面白さは半減してしまう。当たるか否かの際の際。そのやり取りが観客を熱中させる。今宵も興行は大成功。なかでもとりわけ、獣人ロアの火の矢くぐりは、同じくこの後に続けて演じられる、ブリキ人形アイラの槍舞と並び「ジャック・オー・ランタン」の名物演目となっている。拍手喝采、千客万来。だがそれでも、ロアの心は晴れはしない。,笑い方なんて忘れちまった,……死にたくなきゃ、去れ
847,[棄憾王]ドーラ,5,火,どこか遠くに響く叫び。咽喉の奥、腹の底から漏れ出る其れが、自分の口から発せられていることに、少女はついに気が付かなかった。<span style="color:#FF1493"><strong>彼女の父母は、帝国によって処刑された。</strong></span>彼女は椅子に拘束され、頭部に機材が管を通じて接続されている。<span style="color:#FF1493"><strong>少女は適合した者だった。</strong></span>機材が発した電子の火が、少女の脳を激しく灼く。<span style="color:#FF1493"><strong>即ち少女のその身体を、帝国は欲した。</strong></span>それは或る種の比喩であったが、或る側面では事実であった。即ち「少女」は消去され、「ドーラ」はこの世に生を受けた。,この局面を斬り抜けるッ！,選べ、生きるか死ぬか,唾つけときゃ治るって！
848,[壊心王]ドーラ,6,火,ドーラは常に楽しんでいる。如何なる指令も、彼女にとってはのべつ幕無しに与え続けられる、遊び道具に他ならない。時に拷問、時に間諜、時に暗殺、時に虐殺。それらを彼女が実行する時、全てにおいて共通する点がある。それは必ず標的の、真なる友情、或いは愛を得ることである。即ち、それら「信頼」と、其れを裏切ることこそが、最も悪しき絶望を深く心に刻み込む。果たして彼女は、それを唯一の生きがいとしていた。其れが彼女に遺された、唯一無二の真実の痛み。,お前の心も、壊してやるよ,ククク……ド間抜け野郎,ここで死なれちゃ困るんでな
849,[模造型]B.S,5,闇,<span style="color:#FF1493"><strong>[SPEC]</strong></span><br class="spacer">型式：Type/B.S-002-xx <br class="spacer">全高：302　　　　　　　<br class="spacer">全重：864　　　　　　　<br class="spacer">動力：帝国式魔導反応炉　<br class="spacer">武装：電磁式スピアガン　<br class="spacer">備考：被験体融合必須　　<br class="spacer">耐久：約72時間程度 　　 <br class="spacer">※被験体ニ依ル,……戦闘開始,……粛清開始,爆撃信号……受信……
850,[痕元王]ベルタ・S,6,闇,彼女は竜と対峙していた。帝国が造り出したその竜は、何度冥府へ送っても、再び鼓動を取り戻し彼女の前に立ちはだかる。それは単なる実験であった。「死なない竜」の耐久性。ただそれだけを測る為の。何十、何百たる兵が実験の餌食となっていた。彼女の鼓膜を射抜く叫び、瞳に焼きつく四散する四肢。それでも彼女一人は勝ち続けたが、やがて八百ニ度目の戦闘で彼女の頭は噛み砕かれた。彼女が次に目覚めた時、身体は機械と結合され其の名は「ベルタ」と、そう呼ばれていた。,戦闘を……開始する,粛清を……開始する,此の地の全てを、撃ち砕く
851,[幼生王]ゾエア,5,水,ゾエアは深海に棲息する生物である。幼体のゾエアは、その体表が多くの生物の骸で覆われており、また、補給する食物も全て死し腐敗したものばかりである。その為か、海に棲む他の生物がゾエアを捕食することは無い。しかしまた、その気性からか自ら他の生物を傷つけることは決して無く、ゆえに何も食さず自然に餓死する個体も多い。更に、魚類とは異なり両の足で海中を移動する為、海満に落ち命を落とす個体や、誤って陸へ上がり呼吸出来ずに事切れる個体が後を絶たない。,ギギ……キギギ……,……キ……キ………
852,[深海王]ゾエア,6,水,ゾエアは、自ら他の生物を傷つける事は無い。ゆえにその個体の多くが幼生の内に、餓死によって命を落とす。が、極稀に運良く数百年の長い年月を生き残り、その姿を次の段階へと変化させる個体が現れる。その段に至ったゾエアの個体は、体を覆っていた他の生物の骸が剥がれ落ち、それと同時に頭部の結晶が強い光を放つ。ゆえに、他の生物に捕食される機会が飛躍的に多くなるが、しかしそれこそゾエアの罠。気性のゆえに、進化の果てに、辿り生まれた唯一の生存方法である。,ギ……ガガ……ガッ,……ギ……ギ………
853,[幼虫王]ワスペル,5,光,歩く足には履物も無く、枯れ細る腕で抱えるは豊満数多な「餌」の数々。その目は虚ろに遠くを見、それでも口には笑みが貼り付く。そのような男たちが列を成す。その先頭が見上げる玉座に、大きな体の女王は居た。彼女は「餌」を求めている。西の大地の南端に位置する孤島。覆い尽くす密林と、幾つかの集落で構成されるその島で、女王、即ちワスペルは溢れんばかりの「餌」に囲まれ、それでもまだ尚、次なる「餌」を求めていた。そうしてやがて、島には彼女と男だけが遺った。,もっと、もっとでちゅわ！,もご…もぐ…！
854,[蜂虫王]ワスペル,6,光,突然変異か、或いは「何か」の気まぐれか。自身が生まれたその要因を、しかし彼女が知ることは無い。ワスペルは、己が力の全てを用い、近隣全てに住まう者を支配する。男は彼女を奉り仕え、女は全て「餌」となる。やがて女が居なくなると、今度は男が「餌」となる。彼女は種として遺らない。彼女だけが種として生きる。ゆえに彼女は常に独り。何十年も、何百年も。すべての「餌」を喰らった女王は、やがて静かに羽化を始める。そして飛び立ち、あとには何も遺らない。,一刺しでさよならですわ！,その叫び、甘露ですわ…
855,[世望王]ムラ,6,光,人は必ず過ちを犯す。小さなものから、大きなものまで。其れは様々。そして、「罰」を要する過ちが、等しくこの世で「罪」と呼ばれる。それらは常に、表裏を共にし一体に在る。人が侵した「罪」と「罰」。それは如何なる道を彷徨うのか。果たして見定め、届ける為、彼女はこの世に留まり続ける。もはやその身に魂は無く、体は影に呑み込まれ、瞳は陽光に焼かれて死んだ。しかし、その手に持った巨大な「目」だけは、物言わず、この世の全てを、こちらの側を「覗いて」いる。,此の目が、貴方を覗いている,罪……と……罰……,人の……過ち……
856,[飛将]呂布,5,闇,　<br class="spacer"><span style="color:#FF1493"><strong>赤キ業タル猛リヲ秘メシモノ</strong></span><br class="spacer"><br class="spacer">,失せろ！,俺こそが最強！,ぬおおおお！
857,[天下飛将]呂布,6,闇,と或る異界に存在した、武芸を極めし、赤き猛将。名馬赤兎馬を駆り「人中の呂布、馬中の赤兎」と称えられる。己の力を何より信じ、其の力、或いは時には知略を駆使し、様々な局面をくぐり抜けた。其の手に持った方天画戟でいかなる敵将をも弾き飛ばし、根こそぎ蹴散らし前へと進む。,散れ、雑魚ども！,最強の武を見せてやる！,ふん、消えろ
858,[魏王]曹操,5,火,　<br class="spacer"><span style="color:#FF1493"><strong>蒼キ未来ヲ切リ拓キシモノ</strong></span><br class="spacer"><br class="spacer">,思い知れい！,覚悟はよいな？果てよ！,消え失せい！
859,[魏武帝]曹操,6,火,と或る異界に存在した、覇道を極めし、蒼き統王。まさに王たるに相応しき素質を持ち、その才覚を持ってして大国を築き上げた。彼の冷徹なまでの決断力の前には、いかな勇将もおののき、震え上がり、その手に持った将剣は、いかなる苦難も物ともせず、あまねく未来を切り拓く。,我が覇道を示す！,我が覇道の前に滅びよ！,散れい！
860,[活眼美姫]王元姫,5,水,　<br class="spacer"><span style="color:#FF1493"><strong>麗シキ真理ニ至ル心眼ノモノ</strong></span><br class="spacer"><br class="spacer">,邪魔なのよね,覚悟することね,私の役目、果たさなくては
861,[文明皇后]王元姫,6,水,と或る異界に存在した、真理を極めし、可憐なる麗将。幼き頃より優れた知性、胆力に溢れた才媛であり、周囲の者からは、とかく「男なりせば」と惜しまれた。その手に持ったひょうで、あらゆる影を白日のもとに晒し、果てに広がる真実を射抜く。,私にやられたいの？,てこずらせないで,お仕置きよ
862,激昂の雑兵,3,火,[名も無き兵の記録]<br class="spacer">その兵には娘が居た。娘はとても美しく。しかして男勝りな気性であった。或る時、名のある権力者が娘を貰い受けようと、兵らの暮らす村へと来た。娘はそれを拒み続け、やがて無残に斬り捨てられた。兵は怒った。否、村に住む者全員が、怒りの炎を燃え上がらせた。兵と彼らは権力者の住む城へと向かう。それきり兵は還らなかった。,消え失せろ,許しはしない,燃え尽きろ
863,慈愛の雑兵,3,水,[名も無き兵の記録]<br class="spacer">その兵には息子が居た。息子は生まれつき体が弱く、長く生きることが出来ぬと言われていた。或いは都の医者に掛かれば、或いは高価な薬があれば、命は多少延びるかもしれない。戦に出兵することで、それらを得るべき稼ぎを補う。妻と子は心配そうな顔をして手を振り、山を越え行く兵の背中を見つめ続ける。それきり兵は還らなかった。,急いでいるのだ！,すぐ戻る,邪魔をするな！
864,雄心の雑兵,3,光,[名も無き兵の記録]<br class="spacer">その兵には父が居た。父は名の知れた部隊長であり、幼き頃の兵にとってはなによりそれが誇りであった。しかし或る時、父は敵に捕らえられ、それきり還ってこなかった。それでも、やがて大人になった兵の心に、いまだ父の誇りは生きており、兵はそれを支えに、或いは目標にして一人前へと成長した。そして初陣。それきり兵は還らなかった。,でやああああ！,父のように……,落ち着いて……
865,深淵の雑兵,3,闇,[名も無き兵の記録]<br class="spacer">その兵には妻が居た。兵と妻の間には、いつまで経っても子が授からなかった。兵は妻をいたわり、優しい言葉をかけ続けたが、やがて彼女は一切物を言わなくなった。そしてある朝、妻が消えた。行方も、或いは生きているかも、それは誰にも分からなかった。兵の心に、大きな穴が空いた。ほどなくして、兵も消えた。それきり兵は還らなかった。,希望などない,こんなものか……,……
866,悲哀の雑兵,3,無,[名も無き兵の記録]<br class="spacer">その兵には母が居た。母の足は不自由であり、兵は昼夜を問わず一所懸命に面倒を見た。既に老い先短し母ではあったが、それでも兵にはかけがえの無い唯一の肉親であった。しかしやがて貯蓄が尽き、兵は出稼ぎに出なければならなくなった。母は涙ながらに、遺った唯一の肉親を見送った。兵は涙を隠して故郷を去った。それきり兵は還らなかった。,どいてください！,やられはしない！,引いてください！
867,[聖職王]ロイド,5,光,ロイドは生まれる前より聖職の道を義務づけられていた。そして生まれて間もなく、彼が今も身を置く修道院に預けられ、以降毎日、彼は「神」への忠信。誓いの祈りを欠かさなかった。その修道院に属する者たちにとって神は絶対なる存在であり、即ち神にあだなす全ての者たちが、彼らにとっての「敵」であった。皆、幼き頃よりそのように教えられてきた。無論、ロイドも例外では無い。しかし、他者より遥かに「神」に尽くしてきた彼は、もはや「例外」たる其れを越えていた。,「神」よ私をお導きください,「神」に祈りを……,「神」の声が、聞こえるッ！
868,[狂信王]ロイド,6,光,ロイドは生まれてこのかた、己が仕える「神」に対し、罪の意識を抱いたことなどただの一度もありはしなかった。何故なら、常に彼の内なる「神」の声に従い、その意思のままに行動してきたからである。其の日、まず始めに、ロイドは修道院の者たちを全て処刑した。次にロイドは神の使いたるドラゴンの処刑を始めた。やがてその数が膨大になると、彼の元に神なる者が現れた。ロイドは迷わず其れも処刑した。ロイドの耳にはもはや如何なる声も届かず、彼の標は「神」のみぞ知る。,「神」の声しか聴く気は無い,「神」よ！次なるお言葉を！,「神」！「神」！「神」ッ！
869,[毛皮王]ウルル,5,闇,<span style="color:#FF1493"><strong>[GD7018 五十の月・闇の讃日]</strong></span><br class="spacer">ぼくがこいつを見つけたのは、或いはうんめいだったのかもしれない。その日は雨がふっていて、森の中にはあまりけものが居なかった。だからぼくは苔むす匂いの中にかすかに血の臭いが混じってることに違和感をおぼえ、その元をたどった。やがて見えた大きな岩の下にそいつはいた。雨でゆるんだのか。岩とともにたくさんの土砂もあった。そんな中、その下じきになった親に護られるようにして、こいつは小さく、ないていたんだ。,そこにいちゃあぶないぜ,ほら、ででこいよ*1
870,[毛革王]ウルル,6,闇,<span style="color:#FF1493"><strong>[GD7018 五十四の月・闇の讃日]</strong></span><br class="spacer">だめだ。こいつぜんぜん言うことをきかない。きょうも顔に砂をかけられた。いったい何がわるいのやら。あの日、ぼくはこいつを家につれてかえった。さいしょはひどくおびえていて、やたらと咬んでくるから大変だった。今では咬まない代わりに、砂をかけたり、餌をひっくり返したり。困ったものである。でも、寝るときだけはなぜかぼくの寝床に入ってきて、いつもあの日の声でなく。だから、ぼくの怒りはいつもそこでおさまる。,よーし、いいこだ,じっとしてろよ？
